5.0,,"June 2, 2019",No,None,0
5.0,"THIS IS NOT A SCAM
  
","June 2, 2019",Yes,"The reviews here almost made me decide not to buy this phone. I'm so glad that I didn't listen. My phone arrived on time in absolutely perfect condition. I checked all over and there's not a single scratch or dent on this thing. It also has a brand new battery. I verified that my phone was genuine by the serial number on the Apple website and confirmed it was real. The reviews here say that it doesn't come with a stock Apple charger, but mine did as well as the cord. I didn't get headphones, but that doesn't bother me. Definitely give this a try and purchase from one of the Amazon fulfilled sellers. I purchased my phone from Gryphon Commerce.",489
5.0,"As advertised
  
","April 27, 2019",Yes,"I was a little sceptical buying this phone because some of the reviews said that the phone they received was locked or had slight damage. However, the one I received was perfect. It came fully unlocked and  undamaged. It looks as if I had baught it straight from apple. So far an overall 5 stars and no complaints.",264
4.0,"Came in new and unlocked
  
","May 14, 2019",Yes,"I purchased this phone for my daughter and it came with no scratches or marks, however it did not come with headphones",162
5.0,"Go for it!
  
","May 21, 2019",Yes,"Received my IPhone a few days ago and everything is working. There’s a barely noticeable scratch on the screen, but that is normal since it is refurbished. I was hesitant to buy it due to the bad reviews, but my phone is unlocked (checked with Apple) and I love it. My seller was 2019bestsale, it’s a little bit more expensive but worth it.",128
5.0,"Good phone
  
","May 21, 2019",Yes,I don’t know why everyone’s giving this seller a bad review. Excellent phone and fast shipping 5 stars for me . I will be back to buy more soon.,123
1.0,"Not good
  
","May 11, 2019",Yes,"No headphone ,the charger is not original",103
5.0,"theyre very good looking and not glitchy
  
","April 3, 2019",No,i absolutly LOVED this IPhone XR it was wonderful!!!!!!!!!!!,129
4.0,"Great!
  
","May 8, 2019",Yes,"It took a little while for it to arrive. But other than that it is a great phone, nice pictures, its pretty heavy though. But iPhones are not for me, I'm going back to Samsung",100
5.0,"Trustworthy
  
","June 12, 2019",Yes,"This seller is amazing was a bit skeptical at first but this phone met my every expectation, very trustworthy in every way no it doesn’t come with headphones. At least it comes with a charger &amp; a 90 day warranty I also got a brand new spanking battery I’ve checked the serial number online it is worthy!!",80
1.0,"Buyer beware!!
  
","June 10, 2019",Yes,Back was cracked in several places. Screen severely scratched. Phone locked so unable to immediately see if it works. Spent over $800 would not recommend.,75
5.0,,"June 2, 2019",No,None,0
1.0,"FRUAD
  
","May 29, 2019",Yes,Pretty much as soon as I picked up this iPhone I saw that it was very light and to suprises there was an empty box no iPhone no charger no block but just a box inside so a box,62
1.0,"FRAUDS- phones SOLD ARE STOLEN
  
","August 20, 2019",Yes,"Just was told by my carrier, ATT, that this phone is blacklisted. The phone was blacklisted after 1 week of receiving the phone. THANKS AMAZON",59
1.0,"Malfunctioning
  
","June 10, 2019",Yes,The phone clearly has some internal malfunction going on and this isn’t the performance i paid for definitely going to return this product for example i open an app the app automatically closes and there are things that appear on the screen every time the device is in power,56
1.0,"699$ im highly dissappointed
  
","July 3, 2019",Yes,I purchased this red xr about 3 weeks ago i finally decided to activate it i open the box theres no earbuds inside as well as the sim card tray was missing,36
5.0,"That it ships really fast
  
","July 8, 2019",Yes,Phone looks literally brand new no cracks work fine and the battery is 100% like I just brought it from a store 100% recommended this phone,35
1.0,"Nice outside bad insides
  
","May 31, 2019",Yes,I love how it was super intact on the outside but I paid for 256gb it had like 64 and it kept turning off randomly and the battery percentage was going up and down...,34
1.0,,"May 18, 2019",Yes,Pésimo el teléfono vino bloqueado con clave y con fotos de la persona anterior dentro del mismo,32
1.0,"It sucks
  
","May 20, 2019",Yes,World's worst thing ever never get on this its a scam,32
5.0,"Mind Blown
  
","August 13, 2019",Yes,"My phone is amazing! Obviously I’d show it if I wasn’t on it right now. I waited a few days before making this review so I could make sure no quirks popped up.First of all this is the best battery life I’ve ever had on a phone EVER. I went out for 8 hours and came home and my phone was on 74% at the end of the day. Same thing with school. My phone was at about 50% at the end of the school day. Now it charges pretty slowly in my opinion but the slow charging is definitely worth the battery.Size wise the phone is pretty big. It is a handful to hold and hard to throw in my pocket. The screen size is beautiful for watching videos and doing digital stuff but the phone is just a little big.The software works perfectly. The touch is fine, Face ID is incredibly fast and accurate, and it opens apps very fast. It also responds really well to my touch. My last phone did not.The speaker is amazing. It’s so loud that I didn’t even need my speaker in the shower. The phone was loud enough by itself. I took a call in a room full of noisy kids and my dad said he couldn’t even really hear them. So they cancel noise. Microphone is good. I can say “hey Siri” quietly and it’ll activate.Overall I’m really impressed. I was very nervous looking at other reviews but my phone is working so perfectly right now. I am definitely satisfied especially with paying $200 less than apple was charging.Then again I upgraded from a cracked 6s so that could be the reason I’m so over the moon haha",18
5.0,"I LOVE THIS IPHONE XR
  
","May 24, 2019",Yes,I LOVE the phoneXR had it for 2+ weeks and it works perfect. I didn’t get headphones with it BUT being refurbished it didn’t come with the “usual” stuff. I am so happy with the price and functionality of this phone. I contacted the sellers about something the day I got the phone and they replied the next morning and helped me with all my questions. I am more then pleased!!!!!,21
5.0,,"June 2, 2019",No,None,0
5.0,"This phone is fabulous
  
","June 9, 2019",Yes,"I got mine last Sunday and it’s amazing so far! When I got it, it had no scratches, dents, or anything. It’s a great phone! The battery life lasts for like ever! It even said it was in good condition but it’s in fabulous condition! I would recommend GoOverStock seller to anyone. A+++++++ very happy. It even has a warranty till March 21, 2020",20
5.0,"Strong battery, good price
  
","May 26, 2019",Yes,"It arrived on time, I bought for my son, it has great battery life. Good as new, no complaints here.",21
4.0,"Great phone for the price.
  
","September 6, 2019",Yes,"So my wife was in the market for a new iPhone, upgrading from her iPhone 6, which was now obsolete according to several required apps she uses for work. I couldn't bring myself to pay Apple 800 dollars or more for a new basic phone. I tried to get my wife to agree to an Android and that wasn't going to happen. Then I found these Amazon Renewed phones. I wound up saving about 175 dollars on an almost new iPhone Xr.The phone was delivered when it said it would be delivered and does appear as new as possible, less the original packaging and equipment. The box was a repackage box, the power adapter was an unknown USB wall charger and the cable was a lightning cable although it had a crack in the lightning plug housing so it will last about a week.The migration from old phone to new phone took about an hour, with an iOS upgrade in for good measure (this phone came with 12.2 and 12.4 has been out for only a few weeks so it is close to current).Overall, happy about the phone. Time will tell if I run into issues with it lasting but so far all is good.",13
5.0,"Great deal on a pristine phone
  
","June 27, 2019",Yes,"The phone didn't come in an apple box, but the box that it came in was very secure. It came with a charger and a SIM card tool. I have Verizon. I was able to take the sim out of my old iPhone and put it in my new iPhone, that simple no calls needed to Verizon. There was not a single scratch on this phone. It was as it it wasn't even used. The battery life lasts me about 1.5 days, but I'm a pretty heavy user. There are no issues with sound, the ports, or wifi. Such a great deal for such a great phone.",15
5.0,"Don’t listen to all the negative reviews!
  
","August 15, 2019",Yes,"I’ll admit after reading through the reviews I was VERY hesitant but I am BEYOND happy with my purchase.The phone is FLAWLESS. Yes you read that right, absolutely flawless. It came with a glass screen protector already installed and all OEM accessories. Phone has a BRAND NEW 100% capacity battery and is still under factory warranty until May 2020. I understand some of this will vary but this is a review of my experience.I purchased another “renewed” phone, Pixel 2XL, from a different seller and it’s perfectly functional but no where near the condition this iPhone XR arrived in.I just popped my SIM card in and it worked right away. Usually with my carrier I have to call in with the imei number but I didn’t have to. I also tried a GSM SIM card and it worked too, fully unlocked as advertised.Best. Used. Phone. Purchase. Ever.So glad I did not listen to all the negative reviews!",14
1.0,"Phone Not Unlocked
  
","June 8, 2019",Yes,This phone is actually not fully unlocked!,19
3.0,"Crappy chargers
  
","June 24, 2019",Yes,The phone is perfect just wish it came with a good charger come on it came with a android charger with with a iPhone tip adapter 😂wow,17
1.0,"DO NOT WASTE YOUR MONEY ON THIS PHONE
  
","July 27, 2019",Yes,"PLEASE DO NOT BUY THIS PHONE. They say that the phone is unlocked but it is NOT and the only way to get it unlocked is to go to the original carrier, however it is impossible to find out who the carrier was. I bought 3 different SIM cards none of them worked. Talked to so many different carriers to resolve the issue and nothing was resolved. I sent the phone back, got my refund, and purchase a phone directly from Apple. I wish I could get all my time and energy back I used to try and get this phone to work. Disappointed.",13
5.0,"Received faster than expected
  
","May 24, 2019",Yes,It was for my dauther's 16th birthday. She enjoyed it very much and was telling me about all the features.,15
5.0,"I totally recommend this phone
  
","August 27, 2019",Yes,"Very satisfied with this phone. The battery can last up to 3 days, the condition is just as good as new and i’d say it’s worth it.",12
5.0,,"June 2, 2019",No,None,0
1.0,,"May 31, 2019",Yes,"El teléfono parece en buen estado, pero no traía auriculares y el cargador que recibí no sirve... la verdad no aconcejo comprar a este vendedor",14
5.0,,"August 13, 2019",Yes,"La verdad tenia muchas dudas, compre este celular para Ecuador, pero ya llevo una semana y parece completamente nuevo , bateria al 100 % , funciona a la perfeccion.",12
1.0,"NOT VERIZON COMPATIBLE
  
","July 12, 2019",Yes,"Despite all the reviews saying that this device is fully unlocked and compatible with any phone carrier, it is wrong. It is not compatible with Verizon so don't let them scheme you as they did me.",10
1.0,"Blue tooth does  not work
  
","June 18, 2019",Yes,Blue tooth failure should not happen for this age device and something easy to assess during renew phase. I am surprised that they missed this in their evaluation.,10
5.0,"A pretty nice phone for the price!
  
","July 25, 2019",Yes,"Boo yah! My phone came in mint condition with an Apple charger.Something people need to know about newer iPhones is the materials have changed. Opposed to older models that were more scratch resistant but more prone to shattering when dropped, the newer models traded in the scratch resistance factor for higher durability and less likelihood of shattering occurring. There’s a coating on it and yes, you will ABSOLUTELY need not only a proper case for this phone, but also a screen protector. I did not know this until after purchasing this phone and noticed some minor cosmetic scratches from my light usage.My unsolicited advice if buying is to also purchase a case and screen protector simultaneously so you don’t have to deal with scratching. Both can be found on Amazon together for under $20 total.Unless you’re totally rich and don’t care. Then do whatever you want because this is probably your back up back up iPhone.",3
4.0,"Beautiful iPhone and great value
  
","September 20, 2019",Yes,This is a beautiful iPhone however I had some issues with mine periodically it would freeze up and I even had problems with the rotation at one point it took 10 minutes till I was able to get it upright. I even had a few texts messages ithat it wasn’t delivered. But I read some great reviews before I purchased it and I would agree that this phone is a great value and if I haven’t mentioned it’s absolutely gorgeous I would absolutely recommend this phone and the seller they reached out to me right away. Because of my issues is the only reason I give this review a 4 stars. I would recommend that if you purchase this phone make sure that you purchase a case and a screen protector because you don’t want to lose your investment it’s just that beautiful. I truly love this phone and I’m sure you will too. You can buy everything on Amazon so go for it and don’t hesitate.,3
1.0,"Trash....just trash
  
","September 15, 2019",Yes,I originally wanted to give this seller 2 stars because the phone was at least functional but just busted but after continual use I have become irate with this phone. To call it functional would be a compliment. You can't scroll or try to click something because if you do it will pick something else entirely. Just buy straight from apple and save yourself a headache because you aren’t saving much money from buying here regardless.,5
3.0,"great condition, cellular/data connectivity is BAD
  
","July 29, 2019",Yes,"this refurbished phone is awesome! i got mine from ChubbiesTech out of NY and it was perfect! I had almost no trouble switching my service with metropcs from my 6S to the XR. it came on time and looks great! the battery capacity is 100%, and besides one little dent (that i only saw because i LOOKED for it) you wouldn't even be able to tell that the phone wasn't brand new! hopefully phone stays good, but as of now i couldn't have hoped for a better experience with the phone &amp; seller! fedex on the other hand, that's a different story😂EDIT: this phone, while it connected to my carrier, will not stay connected to service. it will say i'm connected, but none of the cellular features or data features will work. i've done everything that has been recommended to me (download apn, reset network settings, get a new sim card) and NOTHING has fixed the problem. as soon as i actually get a response from the seller, i plan to exchange it.",3
5.0,"Great Service and Product 👍
  
","August 29, 2019",Yes,"I received the phone and it was packaged nicely, with charger cord and block.  The body and screen of phone looked brand new, no scratches anywhere.  I did have a slight issue with my sim card not being recognized, so I contacted seller.  Tek Galaxy immediately expedited a replacement to me and it worked great!  They were very polite and handled this in a professional and courteous manner - I would recommend Tek Galaxy to anyone.",5
5.0,"DONT FALL FOR IT!
  
","November 29, 2019",Yes,"Don’t buy this phone!!!! I bought a beautiful blue color, it worked PERFECTLY for two months then it got blocked by T-mobile. I contacted T-mobile and guess what? They tel me this phone was previously owned by a guy who didn’t pay off the full price. Now I’m stuck with a BLOCKED IMEI PHONE and Nono one can do anything about it!!! Tried to return it and the seller won’t accept my return. Currently working on starting an A-Z return request via amazon. Such a disgrace.",5
5.0,,"June 2, 2019",No,None,0
1.0,"PHONE GLITCHY - DOES NOT WORK!
  
","November 27, 2019",Yes,"I bought two phones for my two sons this weekend. One works just fine, one immediately started spazzing and glitching and putting up multiple screens at a time. It’s impossible to use. I’ve been on the phone all day with Apple customer service and now they say I have to take it to the Apple store to verify it’s not working. I’m very frustrated. I just want each phone I bought to be useable and not have to drive all over creation the day before Thanksgiving.",5
1.0,"Scratched Screen
  
","June 18, 2019",Yes,Paid only 100$ less than retail for a phone with scratches on the screen worse than phones I've owned for a year or more. Not to mention non retail  OEM packaging... Truly disappointing,8
5.0,"Surpassed my Expectations
  
","November 1, 2019",Yes,"I was skeptical of ordering a renewed phone from a seller where Amazon wasn’t fulfilling the order, but the seller (ChubbiesTech) came through with a great phone that was legit (checked the serial #, etc.)! I’ve seen no issues at all, but I’ve only had it for half a day. I’m confident it’ll last the 90-day guarantee but I’ll update the review if anything comes up. So far so good!",4
5.0,"Its advantages can completely cover its shortcomings.
  
","July 1, 2019",Yes,"I did not check for negative comments before I purchased. When I received the iPhone XR, it was not the original packaging. It comes with only a charger. It does not have a headphone cord. I am actually a bit disappointed. But because of its price, I think this is tolerable. Most importantly, this is an almost new phone. It looks so beautiful and runs so smoothly. To be honest, this is beyond my expectations. I am very satisfied with this phone. Although its battery display cycle is used 15 times. It has also passed the official Apple warranty period. But it is still worth the money.",4
1.0,"DOESNT EVEN WORK
  
","August 26, 2019",Yes,"Pretty sure I got a fake XR, came in wrong color, isn't the size of a normal XR, won't turn on, came with an android charger. The list goes on.",7
4.0,"Looks brand new
  
","June 28, 2019",Yes,"I’ve had the phone for a week now so far I love it. It looks brand new, great battery life. The only thing is the charger it came with doesn’t work. Luckily I had another one but other than that great purchase.",7
5.0,"Just like new.
  
","August 8, 2019",Yes,"I got the fully unlocked blue iPhone XR. It is in pristine condition. This is my first ""renewed"" pone but I would definitely go for it again. It comes with all accesories in like new condition and it is in fact fully unlocked. I travel a lot for work and have used it all over the world with different providers with no problema whatsoever. It DOES NOT come in a Factory box so just be aware. It comes in a similar box labeled Amazon renewed so think about it if this is important to you. In my case, I gave it a shot and I am truly impressed. Look no further.",3
4.0,"The cell needs to be unblocked.
  
","August 26, 2019",Yes,The cell needs to be unblocked.,8
1.0,"Nope
  
","April 23, 2019",No,Do NOT trust this,30
5.0,"BEAUTIFUL phone PERFECT condition
  
","September 5, 2019",Yes,Honestly blown away!!!! Beautiful condition. Not one single scratch or dent. FULLY unlocked took it right to metro and hooked it up. Signature was required for delivery which I appreciate. I got the coral 64gb for my daughter for her birthday.It was Great deal. Phone comes w charger but no headphones which I knew already.I am so impressed I want to buy another from this seller for myself. It was chubbiestech for anyone looking. I will continue to buy from this particular seller when I have the option. I’ve saw many horror stories buying refurbished phones but I’m telling you this was looked BRAND NEW.,2
5.0,,"June 2, 2019",No,None,0
4.0,"camera issues
  
","August 27, 2019",Yes,theres a pretty heavy lag when using the camera to take pictures or videos. when you take pictures just expect them to be taken a second or so after you press the button.,6
5.0,"It works amazing
  
","August 31, 2019",Yes,The best phone works amazing good as newAnd good price,7
5.0,"I bought this and it’s amazing
  
","May 22, 2019",Yes,You should buy this now!!!!,7
5.0,"Amazing iPhone
  
","December 2, 2019",Yes,"I had a bad experience buying from Amazon Renewed very recently, but I was willing to try them again with this iPhone. I figured that in the worst case scenario, I could just return it again. I am very happy to say that this works PERFECTLY. It's a brand new phone in every way.  I am over-the-moon happy to have it.",3
5.0,"Could Not Ask For A Better Experience!
  
","July 21, 2019",Yes,"The phone arrived in brand new condition in terms of both appearance and functionality. I did see some bad reviews which made me nervous, but I, fortunately, did not experience any issues. The phone was covered in protective plastic and safely packaged in the box with a charger as described and expected.For those of you who’s worry that your phone may not be compatible with your carrier or SIM you can check directly through your carrier to see if the phone is compatible, and, if so, which SIM Card/Part is also compatible for the specific device with your carrier (not all SIM cards are created equally and an incompatible SIM could lead you to think that the phone itself is not compatible or “fully unlocked” when it is, actually).Overall, 10/10 experience with this phone and vendor!I hope that this helps alleviate some stress for someone and lead you to a positive new phone experience!",2
1.0,"Not worth it
  
","August 26, 2019",Yes,"Worked for a few days then the screen totally went crazy, not worth the risk",7
5.0,,"July 4, 2019",Yes,El teléfono se ve y funciona realmente como si estuviera nuevoEstá precioso !!!!,5
5.0,"It might as well be brand new
  
","June 15, 2019",Yes,"After seeing a lot of upset customers on here, I was hesitant to buy a refurbished phone...I was wrong!!!  This phone looks brand new, not a scratch on it, works perfectly.  I have ZERO complaints!!!  If you’re on the fence, don’t be.  I received mine from Chubbies Tech and would not hesitate to buy one again.  This is my new way of buying phones instead of paying full price",4
5.0,"Must buy!
  
","December 8, 2019",Yes,"I bought this fory daughter to use on MetroPCS. We received it quickly and well packaged. It included the original box and charger. It was in perfect condition, no cracks or marked. Powered right up and we were able to log in. For $15 Metro swapped her number and she was good to go. She loves the phone which does take great pics! Battery life seems good, screen colors pop and it's able to multitask with lag time. This phone cost over $100 more at the Metro store and they didn't offer yellow. I would definitely purchase another phone from this company. My teen daughter loves the larger screen, picture taking quality and filters, and facial recognition. This purchase was definitely a success.",1
1.0,"DOES NOT WORK FOR GSM AND CDMA NEEDED CARRIERS (IE SPRINT)
  
","October 12, 2019",Yes,"I paid almost 600 dollars for this phone and waited 6 days for shipping. When it came in, there was one tiny scratch on the back but nothing too major... battery health was 100% and everything was great.. I brought it to sprint to have it switched with my old phone and they were unable to accept it because it only had an imei number and it needs both imei and meid numbers. This phone would work with other carriers that don't require the two different networks. If you have sprint, dont bother wasting time or money, if you dont have sprint or a carrier that requires the two i would definitely buy it. Just so disappointed about false advertising...",3
5.0,,"June 2, 2019",No,None,0
5.0,"Best Refurbished SmartPhone in 2019/2020!
  
","December 21, 2019",Yes,"When I ordered this product, I did not expect the phone to be as great as a condition it was in. First off, the phone came with a Genuine Apple Charger (instead of those cheap 3rd party ones). Secondly, when I powered on and set up the phone, I was shocked to find out that the Phone was only 1 month old and the warranty was still good for another 11 months! And when I went to check the battery capacity, it was at 100% battery capacity and was really well taken care of. Despite all of this, I did find a few scratches on the back, but it’s hardly noticeable and everything else about this iPhone XR is flawless and I was even able to purchase AppleCare+ for only $12.99 a month. I purchased this item through ChubbiesTech and will definitely do business with this company In the near future!",1
