5.0,"Cool phone, but had replace due to display issue
  
","November 27, 2019",Yes,"There are tons of reviews. So I just would add that I like Pixel 4 for face unlock, dual standby with 2 sim cards and new navigation gestures.I had to return/replace one Pixel 4 as there was defect of the screen. In dark environment the top of the screen, about 1/3 inch, was not completely black when I was watching YouTube. So I tried to just open black image and for some reason part of the screen was not off (I attached the photo of that). During daylight this problem is not visible but noticable only in the dark.But with Amazon it was easy to replace overnight.The new perlaced Pixel doesn't have this problem.",2
4.0,"Great phone, kinda bendy
  
","November 21, 2019",Yes,Its the Google Pixel 4 and it worked out of the box. I would give five stars but you don't want to bend this bad boy or you will break it!,3
4.0,"It's not the spec king, but it puts all the pieces together to make a great phone
  
","December 5, 2019",Yes,"If you're looking for all the cameras or 100% screen or 8 gigs of RAM or something, this isn't the phone for you.If you're looking for a phone with great software features, an amazing camera, and regular updates, this IS the phone for you.That being said, I would not pay full list price for this phone. This is why I dropped one star. I got mine for $200 off during Black Friday, which I think was an adequate deal.",2
5.0,"Nothing Rhymes with Orange
  
","November 29, 2019",Yes,"I’ve owned the pixel 2XL, 3 XL, and now the 4xl. I was an iPhone guy before that.  I’m so excited to be able to zoom in on wildlife! It’s absolutely gorgeous as well. The battery life lasts all day and the screen refresh rate is soooo smooth. Face Unlock shocks me at how it works. I feel like I don’t even have a passcode anymore. The solo radar thing is interesting. I haven’t played around with it too much. I was able to snooze my alarm with it, but that’s not necessarily the most productive thing I could be doing. Buy this phone, and also get the pixel stand. Seriously, you’re missing out if you don’t get the pixel stand too. I love that so much I bought 2 of them.",1
4.0,,"October 30, 2019",No,None,0
4.0,"A great phone if you're able to charge midday and don't have a lot of data to store
  
","November 27, 2019",Yes,"I really liked the phone's user interface and google assistant's responsiveness, as well as how quickly everything gets processed. Even the smart switch was very efficient, transferring all data from my old phone including wifi passwords from various networks. Ultimately, I decided that the battery life was poor (which I could have gotten over because the phone charges incredibly quickly) and the storage capacity was too low with 64 Gigs. For awhile, I considered switching for a 128Gig Pixel, but decided that it's priced too high compared to the other options out there. I returned and opted for another phone with expandable storage.",1
5.0,"Worth every dollar and more!
  
","October 28, 2019",No,"The Pixel 4 is a wonderful upgrade from my Pixel 2! I'm not going to pretend to be a professional reviewer as others have done for this product. I can only tell you what my experience with this phone has been as an average consumer with no preconceived notions or biases. I love this phone!What I like:Setup and Updates, (I always go for a fresh install, no transfers!), Camera, Face Unlock, Audio and Sound, Video, Call and Video Call Quality, Display and screen Refresh Rate, OS Performance, Android 10, Motion Sense, Accessibility Features, Battery Life, Google Files App and Sharing Sheet,  Live Wallpapers, The new Recorder App and the Transcribing Feature, Pixel Sounds, Android 10 Gestures, On Device assistant, Build Quality and Look and feel of the phone. There is so much more that I like about this phone. I could go on and on! Using the Pixel 4 is just an overall enjoyable experience!There is nothing that I don't like about the phone. I feel like I got everything Google advertised about the Pixel 4 and more. To me, $799 is a steal!",21
1.0,"Front camera stopped working
  
","December 21, 2019",Yes,"The front camera stopped working, which also disabled face ID unlock. I ran it in developer mode and saw that the front camera is no longer being detected. I called in to Google support and they said that there were multiple reports of this issue.Overall, when the camera was still working; Face ID was slow / inconsistent. I miss the fingerprint reader.Besides that, the phone is a joy to use; it's buttery smooth and the interactions are intuitive. The camera (when working) puts the Samsung portrait mode to shame.",1
5.0,"Pixel 4 is one of the best phones I've ever had
  
","November 25, 2019",Yes,"The design is sleek, Android for Pixel 4 experience is smooth and wonderful.  It can take beautiful photos and portraits, night mode is stunning. The screen is nice when it's running on 90Hz (over 75 brightness).The only drawback is the battery, it drops quite fast, but it's quite the same as my iPhone 7.  So no big a deal.  The screen is a bit yellowish compare to iPhone, but it's better for the eyes, so no complaints.",2
1.0,"Not worth the price and the hype
  
","January 3, 2020",Yes,"While I have had all the Pixel phone before this one, this was such a disappointing upgrade.  The price I paid for was not worth the phone I got.  Face recognition was good for unlocking the phone but most of the all the apps dont support this on Google.  Battery is absolutely terrible.  It is supposed to have a bigger battery then the 3xl but it felt that it was weaker.  The Pixel 3xl is still the best out of the Pixel family and I was so disappointed by the 4xl that I had to return it.  Very bad upgrade on googles part.",1
5.0,"get it on sale for 600
  
","December 1, 2019",Yes,"haven't used it long, but it's really nice so far.personally i wouldn't pay full price for this sort of thing, but i think 600 is a pretty solid deal.",1
1.0,"Wish it was better
  
","January 6, 2020",Yes,It's been kind of buggy so far.  Voice activate stopped working.  The background turned black and I can't seem to change it.  The battery is probably the worst thing.  Doesn't last all day.  I should have read reviews.  I loved previous pixels and just kind of assumed this one would be fine as well.I like the wireless charging and face recognition.Well better go before the battery dies.,0
5.0,"Despite all the negative reviews, this is an excellent device
  
","December 29, 2019",Yes,Coming from a pixel 2xl I had pretty high expectations. The 2xl was an excellent phone compared to what was also out when it was released. I did plenty of research before I purchased the 4xl. I saw all the reviews talking about how horrible the batter is and a bunch of other non sense. I loved my 2xl so much I decided to give the 4xl a chance.The 4xl exceeded all my expectations. I can use this device all day and the battery will last me the entire day. The screen is fantastic. The 90hz display is super crisp and smooth. Face unlock works perfectly. I was originally a Samsung person. But I hated all the bloat ware they would install on the device. The Pixel is the way Android was meant to be experienced.,0
5.0,"Great phone for the price.
  
","November 18, 2019",Yes,"Build quality is fantastic.Screen looks great and controls are responsive.Battery life for me is great. However, I did disable features that I don't have a need for. All of the extras come with a cost after all.",2
5.0,"Best 2019 Android phone!
  
","December 23, 2019",Yes,This phone rocks! Face id works much better and quicker than fingerprint scanning. Phone is well designed and fast. Also the Google fabric cover(though expensive too) is a clever idea and makes the phone comfortable to hold. Pricey phone but well worth it. Google hit a home run on this one!,0
4.0,,"October 30, 2019",No,None,0
4.0,"Excellent camera, google assistant, and other software
  
","December 4, 2019",Yes,"Upgraded from a Pixel 2, which was amazing. The battery isn't ideal but that can be fixed with a power bank. There's no fix for having less than top-tier camera and excellent software. The new software is also amazing: the new google assistant, live transcription, no bloatware etc. At 799 the price is a bit steep, but at the sale price of 599 it's definitely worth it. Face unlock is fast.Cons:1. No more unlimited storage for original size photos2. Motion sense does not work in some countries",0
5.0,"Clean Android experience
  
","December 8, 2019",Yes,Love the face unlock and the assistant that runs on your phones hardware. Narrower design from the Pixel 2 XL is nice for holding.,1
4.0,"Not the best specs compared to Galaxy S10, but still awesome pure Android power
  
","December 4, 2019",Yes,"My only reason for not giving 5 stars is because it doesn't have a microSD slot for expanding internal storage (as Galaxy S10 and others do), 8GB or more in RAM (as Galaxy S10 and other do), or having a single USB-C. plug But I love its simplicity in software and its 90Hz frame rate. If you are an Android purist, you'll love it as I do.",1
1.0,"Bad Experience
  
","December 27, 2019",Yes,"My cell phone came with a huge bugs! This is my 9th ""Google Phone"" the worst until now! Show some bugs when I take photos, battery life it's horrible! Trying to contact Google without success! My first bad experience since my first phone from Google!",1
5.0,"Face unlock is super fast
  
","November 29, 2019",Yes,Ive been waiting for a secure face-unlock on android and it works flawlessly,1
4.0,"I'm confidence with the phone
  
","January 2, 2020",Yes,"For me, I am never a heavy user of any phone, the battery can last me two days of use, most of the time it gets me through a whole day, so that's just not a deal breaker. The face recognition is fast and many have mentioned about the eye-attention problem, it would be great if it is added, but it is still not bad if you can unlock with eyes closed, one can  unlock your phone the same way when you are sleeping if you use fingerprint unlock on any other phones.",0
5.0,"Quality phone
  
","December 19, 2019",Yes,"I keep it locked at 90Hz and it lasts the whole day. Plenty of great features, but nothing that gets in the way of using the phone. I use it for reading and browsing mostly and the image quality is great.",0
4.0,"The Phone To Get For The Perfect Android and Picture Experience
  
","January 1, 2020",Yes,I’ve used Google phones since the Nexus 5. My last phone before this was the Pixel 3 which had great software but terrible battery life. The Pixel 4 XL isn’t perfect and launched terribly overpriced - but being able to snag it on a holiday price helped - the software experience is unbeatable and getting an XL provided a battery boost. Recommended ONLY when on sale because this phone should be a default $700 at most.,0
5.0,"Best Android phone hands down.
  
","December 2, 2019",Yes,"Clean, no bloat, good features.",1
4.0,"Fast!!!
  
","October 24, 2019",Yes,Phone is great. Extremely fast software and hardware. Wish the battery was a little better averaging about 4 hours of screen on time. But it charges very quickly so it's not a huge concern of mine. Build quality is absolutely fantastic. If you are a Android user you should definitely consider this phone or the larger XL model.,1
4.0,,"October 30, 2019",No,None,0
1.0,"Broken microphone
  
","December 25, 2019",Yes,"No fingerprint reaper, the microphone does not work at all and I cannot make phone calls. Since I purchased the device from Amazon, I did not receive a warranty. I payed $1000 for a media device that I cannot use as a phone. Thanks Google!!!!",1
1.0,"Poor QC
  
","December 7, 2019",Yes,"Just bought it with 1 month only, black screen with phone, no impact on it and it just crashed suddenly.",2
2.0,"Wrong charger (Power Adapter)!!!
  
","December 7, 2019",Yes,"This package came with a power adapter which is for Germany, can't be used in USA.  I don't know why is this mistake.  Fortunately, the phone itself works fine.",0
4.0,"New?
  
","December 16, 2019",Yes,"I love the phone except that it came with very small scratches. It's sad, my husband surprised me with this, and keep in mind he got it for brand NEW, for full price.",0
4.0,"Pixel 4
  
","November 30, 2019",Yes,got what I payed for unlocked works with my carrier (VW) but the charger included is a non US style outlet and I don't own any devices with usb-c ports so I can't charge my phone with what was included in box.,0
5.0,"Nice pixel!
  
","November 29, 2019",Yes,"Thanks, cool item!",2
5.0,"Nice nice nice!
  
","December 27, 2019",Yes,This one doesn't support finger print reader. Before I purchased the product I was scared because of some bad reviews but it's better than I expected. I'm still working on getting better night sight shots. But so far I like how simple the pixel phone is. I love the phone 😍,0
5.0,"Love this phone
  
","December 3, 2019",Yes,Pixel is by far the best Android experience.,0
5.0,"Badaaaass phone
  
","December 12, 2019",Yes,"Best phone I've owned up to date. Camera is amazing, do not regret this purchase in the slightest.",1
5.0,"Incompatible with Xfinity Mobile.
  
","December 6, 2019",Yes,Not Compatible with Xfinity Mobile.,0
4.0,,"October 30, 2019",No,None,0
5.0,"This is the second Pixel 4 XL I purchased
  
","December 16, 2019",Yes,"This is the second Pixel 4 XL I purchased, and this is a very good phone. This phone will give to my mom as a Christmas gift.",0
5.0,"Great Phone, Battery Life???
  
","December 24, 2019",Yes,I like this phone a lot. Great size and it’s fast. In my experience the battery will not last throughout the day without being charged several times. Keep your charger close.,0
4.0,"Awesome Camera
  
","December 30, 2019",Yes,"Really loved the phone and especially its camera. Good battery life and face recognition works well. Need to explore all other features but resolution of images , voice quality etc are as per my expectations and I am loving it.",0
2.0,"Disappointed
  
","December 11, 2019",Yes,"Disappointed, was expecting way more. This phone specs match 2015 and not 2019",0
5.0,"Amazing.
  
","November 4, 2019",Yes,Pixel phone. Needless to say.,1
5.0,"Great mobile phone with fantastic camera
  
","December 26, 2019",Yes,"Pixel 4XL is a great mobile phone that probably has market-leading camera technology. So far (one month of ownership), I have not experiences any problems with functions or apps. As a European citizen, I am sorry that i still cannot buy Pixel mobile phones in Denmark.",0
5.0,"Great phone.
  
","December 28, 2019",Yes,Had all the pixels so far. Not much better than the pixel 3 but still better.,0
5.0,"Excellent
  
","November 26, 2019",Yes,Excellent,0
5.0,"Great battery life
  
","December 28, 2019",Yes,It Is false that it has bad battery life. In fact it has great battery life,1
5.0,"Great phone
  
","December 18, 2019",Yes,"The smoothest experience on Android, minus the clutter of unnecessary apps forced on users. The battery life is fine, if not great, however, individual experience might vary.",0
4.0,,"October 30, 2019",No,None,0
5.0,"Good
  
","December 29, 2019",Yes,Good,1
5.0,"Love it
  
","January 3, 2020",Yes,A good phone despite being behind the other new phones in camera and battery size,0
1.0,"Video recording noise
  
","December 25, 2019",Yes,"When recording a video, the video is noisy and cannot be used.",1
5.0,"Fantastic phone, no need to get anything else.
  
","January 5, 2020",Yes,"Great phone, very fast/responsive, great screen and a fantastic camera. This is my 3rd Pixel and they keep getting better.",0
5.0,"Great phone, super fast.
  
","January 2, 2020",Yes,"Face recognition is very fast, camera options are awesome, and battery life has been excellent (easily 2 days with normal use). If Google had added expandable memory, it would be perfect.",0
4.0,"Not bad
  
","January 3, 2020",Yes,"Expected better phone but anyway it's normal. Phone does not has back key, fingerprint and down side three marks. Also expected better camera.",0
5.0,"excellent phone
  
","January 7, 2020",Yes,"So far the best phone I've used.  good battery, excellent sound, great camera;  It also has custom options to adapt the phone to your liking.Without a doubt the best phone",0
1.0,"Poor pixel experience
  
","January 10, 2020",Yes,Recognizes you with your eyes close and the battery life is atrocious.,0
3.0,"Had to return this phone
  
","December 16, 2019",Yes,"Had to return this phone, not worthy $899; poor battery life, poor storage capacity, no 4k video, no ultrawide angle cam",0
5.0,"Good
  
","January 6, 2020",Yes,Love it. Best phone I've ever used!,0
4.0,,"October 30, 2019",No,None,0
5.0,"Amazing device
  
","January 9, 2020",Yes,"Amazing device, don’t know why there was so much hate from the Tech reviewers. Battery life it great, screen is amazing with the 90Hz refresh rate and the software is so clean and intuitive",0
5.0,"Good Product
  
","November 29, 2019",Yes,"I love this phone. Huge upgrade from my Honor 7X. Battery life is good, sound is up to par with what I want, the screen and face reader work very well. Overall, very happy with my purchase",0
1.0,"pixel 4
  
","January 6, 2020",Yes,"Hello, I was forced to return the product to you today because it was defective, light bar in the middle of the screen. Can you quickly send me another replacement product? Thank you for your reply",0
4.0,"good OLED screen
  
","December 19, 2019",Yes,"motionsense works well. face unlock is also good. But when I use fast wireless charger, It works with normal speed. I should buy Qi EPP certified charger, not a normal Qi charger..",0
3.0,"Okay phone with mediocre battery life.
  
","December 12, 2019",Yes,They really need to improve the battery life.  The specs are really middle of the road. I think this will be my last Pixel until Google ups their game.,0
5.0,"2019 best phone
  
","December 21, 2019",Yes,The phone for 2019,0
5.0,"Great buy
  
","January 1, 2020",Yes,A really solid phone. I'm loving the camera. The facial recognition is surprisingly handy and easy to set up. It also has the same great Google setup I have come to love.,0
5.0,"Great phone.
  
","January 3, 2020",Yes,The camera is amazing. Miss having a finger print reader. However face unlock is starting to grow on me. Battery life is ok. The previous pixels lasted longer for me. Would recommend.,0
5.0,"The phone is really really really good, too bad it comes with a high price tag
  
","December 29, 2019",Yes,I like the camera it's what's expected from googleAlthough the video is not that good unfortunatelyThe screen is perfectSpeakers are ok,0
5.0,"Great phone
  
","December 27, 2019",Yes,This is a great phone. But it does quickly and has to be charged often.,0
4.0,,"October 30, 2019",No,None,0
5.0,"Best Android experience.
  
","January 6, 2020",Yes,"This is my first Google Pixel phone. I must say, there is nothing like using stock pure Android directly from the source.",0
5.0,"Google knocks it out the park again !
  
","December 3, 2019",Yes,"Camera amazing, use for work and leisure",1
5.0,"Pixel 4
  
","January 6, 2020",Yes,"I'm happy with my phone, I would like thee keep the fingerprint reader. Work good.",0
5.0,"For the fans
  
","December 27, 2019",Yes,"It's a pixel, I have a bias towards the pixel/Nexus phones been using them for a while. Love the updates.",0
5.0,"Reviews
  
","January 1, 2020",Yes,"The speed of taking photos is improved, but the screenshot operation method is too few.I hope there can be three-finger screenshots.The power is still acceptable.",0
5.0,"Best Mobile in 2019
  
","December 29, 2019",Yes,"No disadvantage, and very very smooth, I like it",0
5.0,"Superb phone
  
","January 1, 2020",Yes,"Flagship phone, top notch camera. However the facial recognition seems less safe.",0
5.0,"Expensive. But worth it
  
","December 22, 2019",Yes,I regret nothing with this major financial decision that is still crippling me today. it makes my life so much easier.,0
5.0,"Great phone with an unbelievable camera!
  
","January 2, 2020",Yes,This phone runs great! The camera and video is absolutely amazing. I am overall very pleased with this product.,0
5.0,"Awesome and Smart
  
","December 2, 2019",Yes,Awesome it's my dream phone,0
4.0,,"October 30, 2019",No,None,0
5.0,"Outstanding, loving it!
  
","January 1, 2020",Yes,Face recognition and battery life are great!Outstanding camera and performance!,0
5.0,"The best of Android
  
","December 31, 2019",Yes,It's super fast but it's missing the fingerprint reader,0
5.0,"Still expensive
  
","December 17, 2019",Yes,Really really good cellphoneStill expensive,0
5.0,"Smooth!
  
","December 30, 2019",Yes,Love it. Just upgraded from a Pixel 1. Everything works perfectly.,0
4.0,"Pixel 4
  
","December 9, 2019",Yes,Nice device,0
5.0,"Phone
  
","December 6, 2019",Yes,"Love the phone and I like Amazon, plus the company got it out pretty quick",0
1.0,"Camera malfunction
  
","December 15, 2019",Yes,Black strips moving across the screen when shooting portrait.,0
5.0,"Nice to afford one during Thanksgiving
  
","December 10, 2019",Yes,Everything's are good except the battery life.,0
5.0,"Powerful cell phone
  
","December 24, 2019",Yes,Pixel 4 XL is a beautiful and powerful cell phone to me.,0
5.0,"No headsets
  
","January 3, 2020",Yes,Awesome camera. There is no headsets tho,0
4.0,,"October 30, 2019",No,None,0
5.0,"Excelente
  
","December 8, 2019",Yes,Excelente teléfono,0
5.0,"Good but not for long time use
  
","January 3, 2020",Yes,Good phone bad battery,0
5.0,"Great phone
  
","January 4, 2020",Yes,Worth it. Great for people who were on iPhones,0
5.0,"Best Android.
  
","December 29, 2019",Yes,Great camera..  solid OS..no crap ware.,0
3.0,"Bla
  
","January 9, 2020",Yes,Was hoping it would be more functional,0
2.0,"Switched back to Galaxy
  
","December 27, 2019",Yes,The battery life was really bad.,0
5.0,"Satisfied customer
  
","November 26, 2019",Yes,"Product is brand new, happy to use my pixel 4 xl",0
5.0,"Great product.
  
","January 5, 2020",Yes,Solid battery.,0
5.0,"Very good
  
","December 15, 2019",Yes,Very good,0
4.0,"Good buy
  
","January 4, 2020",Yes,Good phone,0
4.0,,"October 30, 2019",No,None,0
4.0,"Great phone
  
","January 2, 2020",Yes,Great,0
5.0,"good
  
","December 31, 2019",Yes,good,0
5.0,"The first week was rough. From there it was smooth sailing.
  
","November 26, 2019",No,"So I'll pretense this with the fact that I probably would have given this phone a solid 3.5-4 star rating out of the gate, but I toughed it out and I'm glad I did.The battery was draining pretty quickly for the cost that that was really doing it in for me; no other features mattered if I couldn't get through the day to use them.But I gave the phone a chance and I'm really glad that I did. This is the best android phone I've had. Prior to this phone I was bouncing back and forth between the Samsung Galaxy S8+ and the iPhone X because I loved the iPhone's size camera but I so longed for android's OS which took heavy launcher modification on the Galaxy S8+.In comes the Pixel 4XL,  which gave me the stock android I'd missed so dearly since my old Nexus 6.After charging through a couple of battery cycles, the battery is usually sitting at 50% at the end of the day, so for me, the phone usually lasts about 1.5 days solid, no questions. Battery is never a problem. Its unfortunate that this phone caught so much flack for battery drain because in my own tests, idk if they did tweaks with updates or if the battery needed to be exercised, but I never have ANY issues anymore with it after charging it up and draining it the first couple of times. Now it lasts all day.The camera is unreal. Although people will be frustrated that it doesn't have two cameras on front and 3 cameras on back (the wide angle cameras), the front camera is already has a very wide FOV, much wider than the iPhone X, which made it an instant upgrade for me, not to mention the quality was much better. The rear cameras are incredibly crisp, and exactly what I enjoy, which is true color. I'm not a fan of Samsung's camera software which tends to over saturate photos natively, so the Pixels camera is provides photos that are just how you see them which is how I like them. The night site works incredibly well which I've tested extensively inside, outside, on the move, and stationary. The video I can't speak to because I haven't tested.The face unlock is absurdly fast almost to a fault, and it does work at angles which the iPhone does not. It is, although, quite annoying that other apps don't work with it yet. I'm hoping that changes soon.I've tried my hand at a lot of different manufacturers over the years in HTC, Samsung, Google, Apple, Motorola, and LG, and so far the Pixel 4 XL has won me over as my favorite to date.",11
2.0,"Skip The Pixel 4 and 4XL
  
","October 22, 2019",No,"No fingerprint sensor, unsecure face unlock, a small battery that is exacerbated by a 90hz refresh rate, no ultra wide camera mode, gimmicky motion sense radar chip with the same functionality of a phone from six years ago (Samsung S4) and $1000 for 128GB.You blew it Google. This will be a tremendous flop. For having the engineering brain trust that you employ... You've squandered it.Shame on you.",13
