5.0,"Perfect and interactive
  
","December 19, 2019",No,"The Google Pixel 4 XL is simply amazing. It's fast, responsive, colorful. Its screen is impressively detailed and smooth. The face unlock is brilliant. In my opinion, it's so good that it's easier to point out the negatives, which are the battery life and the limited function of the Motion Sense. The battery just goes away fast when you're fiddling with apps like YouTube. As for the Motion Sense, the music skipping function is very limited, not working with many of the music apps available on the store, which is disappointing if you want to listen to songs you've placed in the internal storage.Other than this it's the perfect phone for Android lovers.",0
5.0,"I love it...sent my note 10+ back because of the trash camera.
  
","December 31, 2019",No,People that hate the pixel 4 watch too many tech-tubers and probally think epstien killed himself. Best screen...best camera...best software features. lasts longer than my pixel 2 xl. Motion sense is NOT the gimmick i thought it would be...when my daughter is sleeping i play sounds from spotify...so when I want to change the song i don't have to switch to the spotify app or ask google to play the next song...i just wave my hand...so easy...i just keep doing what i was doing before.My only gripe is that it doesn't have Wi-Fi 6.,0
4.0,,"October 30, 2019",No,None,0
3.0,"Great phone with sucky battery life
  
","December 20, 2019",No,"Great screen, smooth Android experience. Everything is slick. Camera is good but does some weird things such as blur some things in foreground sometimes. But the worst thing is having to scramble to get to a charger after dinner time. Why Google why???",0
5.0,"Helpful phone
  
","December 21, 2019",No,"I love it.the battery life is fine on the XL version, agreed the ""small"" one battery life is not as good but still usuable 80% if the day with moderate/high use.the cell coverage, and wifi are great!faster download speeds compared to my old phone and bluetooth never has cutout.one other tip,I like using gesture navigation instead of the buttons on the bottom.",0
5.0,"pixel 4 is the best
  
","October 30, 2019",No,"apple fans always try to make this amazing phone fail, am owning the pixel 4 and its the best phone ever ! , skip the bad comments from google haters and buy it",1
5.0,"Far exceeded my expectations!
  
","December 6, 2019",No,"Camera is astonishing. Battery life, while maybe not the best, gets me through the day without a problem. The user experience is wonderful. I just love this love!",0
1.0,"Do not invest in the Pixle 4.
  
","December 25, 2019",No,"Worst ""smartphone"" I've ever had.",1
5.0,"Incredible.
  
","November 10, 2019",No,Best phone I've ever owned. Outstanding.,0
2.0,"Very soft screen!
  
","December 4, 2019",No,"To stars because the screen scratches so easily! If you purchase the pixel 4, do yourself a favor and keep it in the box until you have a quality screen protector ready to install.",0
2.0,"caro
  
","December 10, 2019",No,"muy caro, para pocas propiedades",0
5.0,"Great phone
  
","December 22, 2019",No,Best Android phone you can buy.,0
4.0,"Ch
  
","December 15, 2019",No,Iuh,0
4.0,,"October 30, 2019",No,None,0
5.0,"Best android or 2019
  
","November 29, 2019",No,10/10,0
5.0,"Google has got it going on nice to have an assistant
  
","October 26, 2019",Yes,"I'm really enjoying this pure Google experience learning to let the assistant do for me the things I've done manually for years so far it's the best cell I've owned I've been a OnePlus guy for years and enjoyed the oxygen os and speed from plenty of ram but the simplicity of squeezing the pixel and asking for text, phone call, calendar, flashlight is amazing how quickly and easily it functions even transferring data and contacts from OnePlus and music from an older Samsung tab this was the experience I'd hoped for Everytime I had to do it I'm adding a little more info to this review as I've found the battery has drained faster than expected however I do realize how much more power I'm burning by adding more operations to this cell than before and using more of googles help to do so many things I've learned this sweet little machine can do I've switched on battery saver and it still performes what I need done and then some I don't know about gaming so I can't say how that works out but banking billing calling texting pictures all just got a lot easier for me cloud storage, Google home not new just easier to connect and now I know exactly what and when its backed up not what I thought was so I'm happily impressed with my pixel 4xl",19
3.0,"From a techie - dissapointed. Great software, camera and disppay, but lacking in other areas.
  
","November 13, 2019",Yes,"I have returned this. But read the whole review before making any judgement.Pros.- The camera is the best in the market for normal usage. I say *normal usage* cause at the extremes (low light + filmy potraits + wide angles) iPhone 11pro is better. So, overally - Pixel 4 has the best camera.- Display with 90Hz is the best display out there. Period.- Software experience is amazing. Very clean and smooth.- Very fast and responsive.- Has some new features along with face unlock - it's not perfect by any means but it has potential.Cons.- This $1000 phone doesn't have a fingerprint sensor. Their sub $300 pixel 3a has it. *speechless*- 90Hz refresh rate is not permanent. It goes up and down depending on usage.- Camera cutout at the back is disgusting. But then, it's a personal preference.- No headphone jack and no microsd card slot.- With the forced 90Hz on, my potato has better battery life than this phone.So should you buy it? Yes, if you can get past the cons. Honestly, for some people the cons shouldn't be an issue. I mean we all carry chargers everywhere with us. And the rest shouldn't trouble the average users.But Google easily missed some tricks, for this phone could have been mainstream if few things were tweaked.",18
2.0,"Flagship price without the flagship performance/features
  
","October 22, 2019",Yes,"This review is of the white 64GB Pixel 4 (non XL) that I received from Amazon on 10/21/19. I have used it for exactly 48hrs so far and here is my early impressions –Good stuff –1. The build quality is impressive. The matte back is fingerprint resistant and the phone is a beauty!2. The dual (Stereo) speakers are loud and have good clarity.3. Fast charger is included with the phone.Bad stuff – Unfortunately this is a longer list.1. Battery life is miserable. The phone has a 2800mAh battery that lasted me 18hrs with &lt;30 minutes of screen on time. These 18hrs also included an 8hr of sleep time at night, so users will need to charge this at least twice daily, even with minimal usage.2. The 90Hz screen is mostly limited to 60Hz. You’ll have to enable “Force 90Hz” option in “Developer settings” if you want to use it in its full glory.3. The face unlock struggles in dark. It also sometimes does not work until you press the power button to activate the phone (I have radar on, so the phone does know my presence). In absence of other biometric options, a crappy face unlock isn’t ideal. One out of 3 times I had to enter my PIN, as the Face Unlock did not work. Most importantly, it works even with eyes closed, so it means someone can unlock your phone while you are sleeping by just pointing it at your face.4. There isn't a USB-C earphone included with the phone.5. There isn't a  USB-C to 3.5mm dongle included with the phone to use with headphones.6. Free unlimited storage on Google Photos is being discontinued with the Pixel 4 and Google wants you to pay for cloud storage.7. Base model is only 64GB, which is tiny for a phone in 2019. 128GB should have been the base model or at least a memory card slot should have been included.8. No dual front facing camera like the Pixel 3.9. No wide angle rear camera – This is a big deal for a 2019 flagship phone. Those who watched the Pixel 4 launch keynote, you know how stupid they sounded when they tried to justify the inclusion of telephote over wide angle.10. No 60fps or higher video recording at 4K. Google cited that the limited internal storage is the reason they have not enabled higher fps at 4K, even though the hardware is capable. I am speechless…can’t they just give the users an option?11. Too expensive at $799 for a flagship phone in 2019 with the above flaws.I am going back to my OnePlus phone, which isn’t flawless by any means, but is a very good phone for what it offers and the price it comes at. I can't recommend the Pixel 4 to anyone and don't know if the audience that Google is trying to sell this to, actually exists. If you really want a Pixel, get the 3a...it is a great phone at a very good price!",16
1.0,"What happens when you have a software company designing hardware? Huge ill-informed disappointments.
  
","October 26, 2019",Yes,"I used to wish I had a Pixel 3/3XL instead of my S8+, but I always told myself I would wait for the Pixel 4 to release before blowing a load of cash on a shiny new google device. I used my Pixel 4 for a day before returning it.Pros:1. Fantastic software - The entire interface, assistant, and just general ""all built in"" feel of using the phone is fantastic. However, Google is at it's core a software company, so this would make sense. It's THEIR ecosystem. We can only expect this.2. Solid build quality. Feels like a great phone. Responsive and clear display.3. The camera. I'm gonna miss this. It's pretty great and the magic google works on your photos often works out to make them look instagram/facebook/twitter ready without any tweaking.Cons:1. The battery life. I can not even begin to state what a huge, massive, gaping CON this is. The night I got it I used it a bit, got the battery down, and gave it a full charge in the morning and started the day with a full battery at about 10 AM. By 6:30 PM with minimal use over the course of the day here and there, 30 minutes of bluetooth music streaming in my car, some browsing etc., it got down to 9%.NOW, like I said, it was at 9% at 6:30 PM. What happened next was amazing. I hopped on the phone and opened Chrome, and while just browsing the web watched the battery drop percent by percent from 9% to dead over the course of SEVEN MINUTES. It just kept ticking down right in front of my eyes. Almost 10% battery life gone over seven minutes of web browsing. This totally blew me away.In case you haven't caught on to everyone's point of judgment yet, the pixel 4 actually has less battery capacity than the Pixel 3. This was  huge mistake on Google's part. This device consumes more battery life from a lower total supply. Unforgivable.2. The whole telephoto thing... Google did a regular lens and a telephoto lens. No ultra-wide. They gave some reason why but it was a bad reason based on how ""they feel.""3. The price. This is a flagship and is priced like a flagship, but is falling short of cheaper alternatives like the Oneplus 7T.I'm really bummed that this phone didn't work out for me. I just absolutely can not tolerate my phone dying after ~3.5 hours of use. I can't even imagine if I had tried playing Pokemon Go on it or something battery intensive. What if I were in another country and were relying on this thing? It just really doesn't work. I would have dealt with everything/almost anything else if not for the battery life issue.I hope that google really feels some serious scathing pain over this device pushing them to do a better job next year, because I REALLY wanted a good Pixel, but I won't be shocked if by then Amazon has released a phone that outperforms it in every way attached to their own ecosystem, like they have done with countless other products.This could have all been easily figured out and resolved of course, had the company made the specs of their phone public far earlier. The cries of ""what are they thinking?"" could have possibly allowed them to quickly pivot and resolve these issues, but instead they waited until a week before release to show off their paperweight.This has to some degree turned into rambling. I'm annoyed, I'm disappointed, I expected better.Just don't buy this phone.UPDATE: Due to a newer review stating that I ""must have had my phone on max brightness streaming 4K video"" I'm making this update to clarify my usage even further. I had the phone on adaptive brightness as most people would, and at no point did I stream video. It also looks like fake reviews are starting to pop up. I have no idea what the review about ""google haters and iphone lovers"" is about.",17
5.0,"Dual Sim Dual Standby and Dual Network problem solved...
  
","November 6, 2019",Yes,"I had been looking for this technology for a few years,  because my corporate phone is on Verizon (CDMA) and my personal phone is GS/LTE , which meant that I had to carry two phones because of this issue.Pixel 4 DSDS and dual network capability (only phone on the market with this capability as of now), solved my problem in that I can now carry a single phone with 2 numbers in both CDMA (Verizon) and GSM/LTE coverage area.Good job google. I am willing to bet that Verizon hardware sales won't like this phone.There is however a downside with any phone that uses an eSim (yes one of the two sims on Pixel 4 is an eSim while the other is a physical sim), is that if your phone gets damaged, you will not have a physical sim to use in your spare phone and you must then get a physical sim activated by your provider...which means when your damaged eSim phone has been repaired, you will then have to download the eSim back onto your eSim phone (which I think will mean yet another visit to your provider)This is of course not a problem if you don't have a habit of breaking your phones, like I do.",13
3.0,"First thing to do: Manually update all the apps
  
","October 25, 2019",Yes,"So considering switching from the iPhone and testing this out. We are not off to a good start.First off, I was excited by the possibilities of the new Recorder app and built-in transcription. Turns out, this is not installed by default when you get the phone. It's the old Recorder (version 0.5).To get the new Recorder, along with many of the other features that Google touts the Pixel 4 having, you have to go manually update all the apps (Open the Play Store, Select Your Apps, then Select Updates). THEN it installs Recorder 1.0 which has the transcription stuff.However, this is not obvious. Why would Google ship with Recorder 0.5 and other non-release version apps? Frustrating when you're trying to check out all the 'cool' new features touted at the launch. Apple would never do something like this. At least automatically update all the apps when it does the initial 'Check for System Updates'.Secondly, Google's support is useless. They don't know anything and that's assuming you can figure out how to contact them.The camera is great, but nothing special compared to other phones at this point. The HDR trick they use to deal with low light photos leaves something to be desired. I'm not crazy about the look.With the Just Black phone, both front and back are glass which makes it somewhat slippery. You'll probably need a case with it. It's frosted along the sides which is great, but it'd be better if there was more surface area on the back that was frosted.So, a little disappointed with how frustrating it's been out of the box. Now that everything has been updated, we'll see if the user experience improves. Right now, I'll probably return this and stick with the iPhone.",7
5.0,"This phone will not disappoint.
  
","November 9, 2019",Yes,overall the phone is fast and has not disappointed. The battery life is really good and the 90hz screen is awesome. The phone is a little pricey compared to the other flagships but i really enjoy the vanilla google android experience.,8
4.0,"Pixel 4 XL is a great phone, but yes there's room for improvement
  
","November 21, 2019",Yes,"There's thousands of reviews of this phone at this point, so I'll just break down the pros and cons for me personally:Pros:- 90Hz refresh rate is nice and smooth- Astrophotography mode is amazing in the right conditions- Night sight is also really cool, and gets great shots I'd never get otherwise- Zoom on rear camera is useful and software takes care of a lot of the problems you'd see otherwise- Assistant is very snappy- Phone performance is good, not a lot of apps auto-closing, everything feels responsive- Face unlock is reliable- 600MHz Band 71 support - I've seen 200Mbps+ download speed on speed tests- Fast access to security updates- Speakers are good, not the best I've heard on a phone, but above averageCons:- Low storage, I got the 64GB model and I think I'll be ok, but I do feel a bit strained for space- No 4K 60fps video recording- No ultra-wide cameras- No fingerprint sensor- Rounded screen corners aren't my thing- Screen could be brighter (acceptable though)- Kind of picky about wireless fast chargers, although less picky than the Pixel 3- No headphone jack- No HDMI outSome other things are both pros and cons. Battery life is more than acceptable, not a top feature. Video stabilization is good, but looks artificial at times. It's different from the iPhone or a GoPro with HyperSmooth. Soli is neat but I don't use it for gestures, just proximity stuff and to speed up face unlock. Screen resolution is a good balance of resolution and performance on the XL. Would have liked to have seen Gorilla Glass 6. The buttons are accessible and I'm good with how they feel. Would like to see a 5G variant in the future as well.",4
4.0,"Battery isn't bad.
  
","October 30, 2019",Yes,"I'm only writing this because the negative are pathetic and not even close to realistic in my experience in the first week of owning the phone. The battery is fine. I am coming from a pixel 2 and the battery lasts longer than that phone easily. From full charge in the morning, to browsing the internet, listening to music via bluetooth headphones, checking email, etc etc periodically through the day, I usually end up with about 40-50% battery left easily. To say its done within a couple of hours, that person must have max screen brightness and streaming 4k videos. The screen is incredible, and camera flawless. I am however taking off a star due to not caring for the round edges on the screen and am still having a hard time adjusting to face unlock over fingerprint. Everything else about the phone is nothing short of extremely well executed.One more point, how on earth is face unlock any less secure than a fingerprint scanner? Both can only be opened by the person using the phone. And someone could just as easily put your finger on a scanner as moving it over your face if you're incapacitated. So confused by that one, but that guy got on here to troll as he doesnt even have a verified purchase. Not sure what his agenda is.",5
4.0,,"October 30, 2019",No,None,0
5.0,"Very quick and responsive
  
","November 9, 2019",Yes,I love my new black Pixel 4 XL.  It's noticeably quicker and peppier than my old Note 8; the pure Android experience without any Samsung or AT&amp;T bloatware pre-installed is fantastic.  The face unlock works well.  Google Fi works wonderfully with this phone.  I can't recommend this phone enough.,7
5.0,"Wish the battery was bigger, love the phone
  
","November 15, 2019",Yes,"Great stock experienceBad battery lifeCamera is greatYou'll need a wireless car charger to ease your lifeI run 1.5 hours of GPS (waze) everyday. I suspect many people use phones to navigate traffic.Motion sense will not work in unsupported countries ( there are workarounds for this)Crash detect will not work in unsupported countries (no work arounds for this)Esim works with any carrier that supports iPhone esim (if you can't see the option, enable developer mode, and it will appear instantly)",6
4.0,"Read My Review!
  
","December 4, 2019",Yes,"So I've had the Pixel 2, Pixel 3, Note 10+, and now the Pixel 4 XL.* If you've had the Pixel 2 or 3, this is well worth the upgrade. Critics knocked this phone, but I gotta tell ya. It's fantastic.Pros:* The Vanilla Android Experience. It's fantastic. Much better than Samsungs or LGs UI.* Camera - I don't care what DXO Mark says. This and the Iphone 11 have the best cameras. I was using the Note 10+ before this and it doesn't even come close. If you have kids that move around. This is the camera to get. Hands down.* Face Unlock - Never thought I'd appreciate it so much. Fast, accurate. Fantastic* Screen - Fantastic. Smooth. I turned the 90Hz off and didn't notice a difference. It's great.* Sound Quality -  As good as the best out there.Cons -* Battery life is Good. Not terrible. But at these prices you expect Google to keep up with phones like the Note 10* They took away the finger print scanner, which is fine, but with that they also took away the ""Menu Down"" feature you could use w/ the finger print scanner. That....I miss.* I would have wanted a bigger screen for this price, bu that's me being picky.* Price - Only buy this phone on sale. Not woth $900 or 1K . I bought it on Black Friday.I went from the Pixel 2XL to the Note 10+. I wasn't happy with the Note 10+. Battery life was fantastic but the pictures were just terrible. I gotta tell you....this is the phone. Nothing comes close the user experience for me. Love it.4 Stars due to the Cons, but I'm 5 Star happy lol.",3
5.0,"Don't Listen to the Haters
  
","December 4, 2019",Yes,"This is a very good phone.I pre-ordered mine (128 GB White) for essentially the Black Friday cost ($799 for the phone + $100 amazon gift card = $699).You already know that the camera is outstanding.The battery is fine. Maybe if you can kill the battery in 12 hours, you should put your phone down once in a while and enjoy real life. Plus, with wireless charging, is it really so hard to top off the battery during the day? The only time I have every been surprised with battery drain was when I was in a region with poor cell service, but that's not the phone's fault.Face unlock is super fast. I really don't miss fingerprint unlock, assuming Chase gets it together and adds face unlock support. People are crying that face unlock works while you are sleeping and that is ""sooooo insecure""... um do your fingerprints disappear while you sleep or close your eyes? Google will add the eye open check in the near future and it will be more secure than fingerprint, which it currently matches. Calm down.",2
5.0,"Recommend
  
","October 27, 2019",Yes,Awesome phone 👍👍👍👍👍,6
4.0,"Good phone if you manage to get it on sale
  
","December 2, 2019",Yes,"So I decided to buy Pixel 4 since I was being really disappointed with the direction that Samsung was going towards in terms of hardware and software. Here are my impressions after some time with it when comparing it with my Galaxy S9+ :Hardware features: I don't really care for headphone jack but it is inexcusable that Google removed fingerprint sensor. Using it is much more convenient than face unlock and fingerprint sensor is much more reliable in all light conditions. I really miss it when going from S9+ to Pixel 4. Bring it back, Google.Display: the display quality on my Galaxy S9+ is better - it is more uniform and feels like it is more color accurate. Especially when looking at it at an angle or turning the phone. On the other hand I really dislike curves on the sides of Galaxy display and I like that Google went with flat display. I also dislike that Samsung is putting random notches and holes into their display on their latest models and I like how Google has finally abandoned this trend and hopefully future Pixel devices also won't have any notches or holes.Battery life: the battery life on Pixel 4 XL is better compared to Galaxy S9+. Not really surprising since Samsung puts a lot of their own services running in background. However, having more battery capacity would be even better since Pixel 4 XL lasts less on single charge than any iPhone 11 model or some Android phones with higher battery capacity.Software: Google's software experience is great and I like it much more than Samsung and its awful One UI. No huge wasted space, no excessively rounded corners, working spam call protection, better messenger, no bloatware, no redundant apps. The only issue with Google software is they put the search bar on home screen which I do not want to use and you cannot remove it unless you will use different launcher.Sound quality: the sound quality on Samsung Galaxy S9+ is better. It is more neutral, with less bass emphasis.Photo quality: it is better on Pixel 4 in all modes.Video quality: Galaxy S9+ takes better video quality and it can record 4k 60fps videos, Pixel 4 cannot do that.All in all Pixel 4 XL is a good phone for the current sale price but it should have been much better considering it is a flagship device and considering that whole idea of Android and their devices is to give users more choice. Hopefully Google will bring fingerprint sensor back in future devices, give more video taking options and give larger battery capacity (even cheapest iPhone 11 is beating Pixel 4 XL in terms of battery use).",0
