2.0,"Pixel 4 no finger print reader don't buy
  
","November 7, 2019",No,The irony is TMobile has 55 discount plan which is good so I jumped ship from att . That's the good . Pixel 4 is a mediocre phone at best . The gester for controlling the phone is confusing. thank God Android 10 has ability to reinstate 3 buttion control or phone would been returned. My biggest gripe is taking away fingerprint scanner this makes it almost impossible to unlock with one hand .you have to use a password manger as a work around. It basically brinks any bio setting for all apps.  Yes the phone has facial unlock . It doesn't work if your lieing down or in a dark car . Seems obvious Google didn't figure on this . My biggest hatred I suppose is Android being a knock off of IOS. Sort of a space 1999 of phons full of promise great actors but with a rotten unbelievable premise . I can't in sci fi terms suspend my disbelief and like comic book guy in simpons reviewing his creation. So i say this is crap .my problem is deed is done but I still returned the phone. No sale defective product. Google mis designed no fingerprint button brinks biometric apps. You have to hack the phone to restore it not good.  RIP fingerprint button. Don't purchase this turkey.,10
3.0,"Face id blows
  
","November 25, 2019",No,"Unlike fingerprints on earlier pixel phones, you can't add multiple face ids.I normally don't shave often, and stubble grows. Seems like the face id doesn't recognize me when that happens, and also while wearing sunglasses,it works sporadically.Also, my wife sometimes uses my phone. And can't use the feature.All problems would be fixed by having multiple face ids, unfortunately that isn't possible.As it is, the feature is quite annoying, since if i have to remove my sunglasses, not to mention shave, to get it to work, then that's not going to happen.As this is a pretty basic feature, i can't currently recommend the phone.",10
1.0,"Completely not worth it
  
","November 26, 2019",No,"Completely not worth the money, and there is little to no improvement from the 3 or the 2.  I upgraded from the 2 XL which was and is a really good phone, thinking there was more to this 4 XL.  I upgraded my wife's iPhone 6s to the 11 pro and man - if I wasn't such an avid hater of iOS and all things Apple, I would take that phone in an instant.Pixel 4 XL Cons:  Battery life sucks already.  I can barely make 7 a.m. to 11 p.m., so I imagine this will degrade very fast in the near and distant future.  I don't take a lot of pictures, but if I do video it drains quick.  Watching videos the same situation.  I don't use the phone hardly at all, and text message a lot, and I'm always below 15% every night.  Audio port still gone for no reason I mean seriously?  The bar across the top.  Really?  For a sensor that Samsung failed to spread with the Galaxy 5?  Really?  Swipe my hands really?  No wide angle lens like the iPhone 11 pro, but yet a massive box on the back.  Ugly.  Vibration is still really poor.  How can you not have this as a setting to increase?  My legs are, as a result of decades of cell phone vibration, immune to Pixel vibration.  Tried the iPhone 11 pro and it's much more noticeable.  Sound volume still sucks.  It just doesn't play loud enough, especially speaker phone.  Like seriously it's mandatory to have wireless ear buds just so I can hear anything on my phone?  Or a bluetooth speaker?  Incessant Google Assistant - Quit asking me to set it up I'm not giving you my voice data regardless of how many times you ask.  And last but not least, my biggest gripe with Google services in general - backups.  There is ZERO support for full backups of your phone.  Especially your SMS and MMS.  ZERO.  So if you don't use a 3rd party app on a regular basis to backup your phone, you are screwed.  Don't ever let anyone tell you different, if you do a factory reset without a backup all of your app data including Messages will be erased and irretrievable.  Shame on a billion dollar company to not 1 let you know ahead of time, 2 false advertising that it can even do backups and 3 doesn't provide backup options.  SHAME SHAME.Pixel XL 4 Pros:  128 GB of storage?  The 90 hz that I can't use in any app but is supposedly there?All in all I'm more than disappointed in myself for buying this thing, especially on launch day when it's dropped $200.  And I'm just disappointed in Google.  They ruined my experience and there's nothing new on this phone that I didn't already have on my 2 XL.Unfortunately I still like the Google ecosystem but this will be my last Google phone.  I'd take that over priced Motorola Razor at least it has something new in it.",7
5.0,"Great Phone
  
","October 30, 2019",No,"I'm an iPhone user and bought the Pixel 4 for it's camera.  I do a travel blog and I've been dragging a Nikon D7500 camera with an 18-300mm lens with me.  The Pixel will allow me to put the ""camera"" in my pocket when I'm not using it.I've been testing the camera and It's not the same as the Nikon - it's better in low light but has some weaknesses in regular light.  The zoom is good and bad.  It will zoom well and give me a sufficiently sharp image - but the resolution (number of pixels) is not that large.  If I crop the picture there's not many pixels left.In regular light, I find the color and contrast a bit ""sharp"" which makes the picture look a bit processed.  I'm working on improving that with the adjustments I can do on the camera.  The Pixel does provide RAW images but they don't give me as much adjustment range as the RAW images from my Nikon.Some people complain about the lack of a wide angle camera but I can always do a panorama.  The battery should have been bigger so I'll get a battery case for it to make sure I have sufficient charge.  It just makes the phone a bit thicker which I don't object to.Otherwise, I find that Android provides pretty much the same features and functionality as my iPhone but does them differently so there's a learning curve for me.  Not really hard but it'll take time for me to be comfortable with it.Computational photography is obviously the future of photography and I expect that Google will make improvements to the camera over time.  But for my use, I think the Pixel 4 will release me from having to lug around a big camera and lens.  I bought the 128GB version to make sure I have enough memory for pictures, especially since I use the RAW function.  I'll dump the pictures to my computer each night.  I shoot more than four thousand pictures on a normal trip so dumping them off the phone each night is necessary.Overall, I'm pleased with the phone.  I really need more time with it but it looks good so far.",3
4.0,"Excellent phone
  
","October 31, 2019",No,"The phone's screen, camera, and assistant are all worth the cost of this phone. The battery is definitely small but with the options of wireless charging, portable batteries, car charging who is really out of reach of a power source that often? All the extras in the cutting software are just icing on the cake.",7
2.0,"Snapped along the antenna lines on the sides within 3 days
  
","December 4, 2019",No,"I bought this phone to replace my Pixel 3 XL, because its rear camera died 5 days after the warranty ended. (sigh)Initial impressions were poor. The lack of a fingerprint reader sucks, no matter how fast the face scanning is. I could unlock my Pixel 3 with an index finger before it even left my pocket, which is now impossible. It also doesn't always wake up and scan, meaning you have to tap the screen until it scans.The radar gimmick is, well, a gimmick. The only thing it seems to be useful for is swapping between songs, but it's very VERY unreliable even for this. It doesn't consistently detect swipes, so you end up waving your hand at your phone frantically with nothing happening. It's also supposed to wake up the screen when you reach for it. Again, the success rate of this seems to be pretty low, meaning you again have to tap the screen to wake it up. Wouldn't have been a problem with a fingerprint reader.I was ready to get over these deficiencies after the first couple of days, but then the worst thing happened. There are four antenna lines that run horizontally on the sides of the phone, under black paint. They're positioned above the power button and the SIM card tray at the top, with two more at the bottom somewhere. Somehow the entire phone bent inwards and snapped at this point, leaving two cracks on either side and the screen bent slightly inwards.I realize this is likely my fault, and I probably leaned on my pocket or something at some point. But I am 100% sure I did not put an excessive amount of pressure on the phone in the first few days. I've used the Pixel 3XL in the same pockets for the past year, and the Pixel 2 before that. The thing just snapped like nothing. There's no reinforcement in the sides whatsoever.This is a $1000 phone. Why does it feel like a cheap iPhone knockoff? I can't stand iOS, and Samsung are slow on updates. Google needs to step up their game and make a phone that's worth the pricetag.",2
4.0,,"October 30, 2019",No,None,0
1.0,"Pathetic phone with really bad battery life
  
","November 27, 2019",No,Started freezing after 4 days. Less responsive. Need to charge twice a day.Save your money and get an iPhone.,7
1.0,"Do not trust this manufacturer
  
","January 4, 2020",No,"I bought a Google Pixel from Best Buy in August - within the first week I noticed the Bluetooth kept disconnecting and would cut in and out. I worked with google over several weeks, resetting my phone multiple times, before they finally agreed to replace the phone under warranty.They do not offer anything to ensure you are not going phoneless for the up to 10 days it takes for them to receive the old phone and send a new one. They won't allow you to purchase and get a refund when the replacement arrives like many other manufacturers. So if this happens to you - you'll be severely inconvenienced.When I finally received the replacement, it took less than a month for the back camera to completely stop functioning. There is nothing to view in the camera - just a black screen.So two different instances of this phone broke within less than four weeks. Do not trust this manufacturer to provide a product that will work.",2
2.0,"Promising but ultimately disappointing
  
","December 23, 2019",No,"I enjoy google products and for the longest time wanted to try a pure Android phone. Bought Pixel4 and really tried to like it. Setup was simple, transferred data from my Galaxy S7 and started setting up security. That's where I realized there is no fingerprint reader. Not the end of the world but it's convenient, reliable and many apps use it as a primary authentication. OK, Google suggests FaceId so I set it up. It worked well at first, even though I can't call it ""secure"" because anyone can take your phone, point it at your face even when you are sleeping, and it gets unlocked. Still, I thought I'd get used to it. Within 2 days face unlock simply stopped working. I tried re-setup it, no luck. Says ""unable to recognize"". I had to go back to using a pattern which is not secure at all. Typing a pin code is a pain in the butt. Within a day the pattern recognition stopped working, not sure why. Tried searching for answers, the resolution is factory reset which you can't even do through normal settings... that didn't fix it either, so phone became useless. I ended up just returning it and getting a Galaxy S10. Not what I was hoping for but ultimately proved to be a better product. Sad to see that Google still can't make a decent Android phone.",1
1.0,"An expensive, underpowered, underfeatured device
  
","December 2, 2019",No,"There are a few things to like about this phone. It's aesthetically attractive in my opinion, and pure Android is nice, when Google Assistant isn't bugging out, and when Google Maps works, and when Alarms actually ring, etc. But this phone is buggy, lacks any reasonably secure biometrics, and has awful battery life. No thanks.",3
5.0,"A really great phone for the right user
  
","December 4, 2019",No,"First off, I waited until Black Friday to buy the phone because I knew there would be a significant price drop. I will never buy a Pixel phone on day one unless I win the lottery and money becomes no object. I recommend waiting that month to anyone who isn't rich.I upgraded from a Pixel 2 XL and owned a Nexus 6P before that. I enjoy Google's version of Android quite a bit and consider the hardware trade-offs worth it. My wife has a Samsung Galaxy S10 plus and there is no question that it's a more refined phone as far as screen, battery etc, but Samsung's version of Android -- while better than it was a few years ago -- is still bloated and unappealing to me.I consider this phone a worthwhile upgrade to my Pixel 2 XL. The screen is much better, and while it could be brighter it is noticably brighter in sunlight than the 2 XL. The 90 Hz display refresh rate makes for noticably smooth scrolling and is a welcome improvement, I have enabled it all of the time in Developer Options with no big jump in battery usage.The upgrade to 6 GB of RAM is also a welcome upgrade. I know that it's still stingy by flagship standards, but I see no lag in the phone so I'm okay with it.The black phone is indeed, as others have noted, a fingerprint magnet, but my phone always goes in a case anyway. If I didn't use a case I would definitely go with white or orange though.Wireless charging is a nice upgrade from my Pixel 2 XL, and from what I hear about the Pixel 3 much faster than on that phone.The battery life is fairly meh, but I find that even on heavy use days a quick boost during the day gets me through. Since I use Android Auto on my commute and the phone charges while plugged into that that's more than enough to get me through any day. I also have a wireless charger on my desk at work if need be. If I was in a situation where I was unable to charge my phone during the day the battery life on this phone might seem like more of a negative. If you are a heavy user who demands to go all day without charging than this probably isn't the phone for you.One thing I love about this year's design is the relatively flat screen. The curved screen of my 2 XL demanded an expensive Whitestone Dome screen protector to protect it without losing screen sensitivity, as does the curved screen of my wife's Galaxy S10 plus. The flat screen of the 4 XL only needs an inexpensive tempered glass screen protector to work perfectly and protect my investment. And I like the way the phone looks.I love the camera, which is always a strong point with Pixel phones. When I shoot video I use 1080p rather than 4k, so the fact that the phone doesn't support 4k 60 for video doesn't bother me. If video at that resolution and frame rate matter to you than this isn't your phone. I love this phone for still photography, which is a personal hobby, and the addition of the telephoto lens is a big plus. Wish they added a wide angle lens, too. That would have been a big plus. I don't shoot many selfies, but I know some users are bummed about the removal of the wide angle selfie camera from the Pixel 3. If that's important to you then you might want to get a different phone.I really like the face unlock. It has worked well for me. Fast and consistent. I don't even think about it much anymore, it just works. On rare occasions that taking my phone out of a pocket doesn't trigger the face unlock then double tapping the screen wakes it up.To sum up, while I don't think this is a perfect phone, I believe that the Google software experience combined with the camera and the bumped up RAM makes it a worthwhile upgrade for those like me who really like Pixel phones. I don't think they're for everybody, but I wouldn't hesitate to recommend this phone. One thing I would definitely recommend now that the phone has returned to post Black Friday full pricing is to wait for the next sale.As stated above, this phone isn't for everyone.  No phone is.  However, if you pay attention to the strengths and weaknesses and assess your own needs correctly it really is a great phone for the right user. I'm happy to stay in the Google Pixel experience for the next 2 years.  When I'm ready to upgrade I'll look at what will probably be the Pixel 6 XL and decide if that phone has earned the next 2 years of my phone usage.  Even if it does, I will certainly wait until the phone goes on sale to buy it.",0
1.0,"Buy a Pixel 3 instead
  
","December 17, 2019",No,"I've purchased every Pixel phone on day 1 and been happy - was an iPhone convert and loving it - until this thing.First off it's heavier and thicker than the Pixel 3, it feels less premium in the hand. The camera is not noticably better, and to top it off the screen flickers when they keyboard is up. (Still not fixed).The last straw is the always on display which will never get dim enough at night. Pixel 3? Perfect, readable but incredibly dim, Pixel 4? Blinding. How did they ship this thing?Next they drop the price $200 a month after launch to make sure loyal Pixel fans like myself feel like a proper idiot for taking the bait.My wife was already using my old 3 so I bought another Pixel 3 to ""downgrade"" to. Much better.",2
4.0,"Not great not terrible
  
","November 28, 2019",No,"It's not the greatest of the Android flagships, but it's a good phone.I preordered the Pixel 4 XL and recently got my $100 Google Store credit, only for it to drop $200 for Black Friday, lol. I could have waited a bit longer but my Nexus 6P went into an infinite boot loop a couple months ago after nearly 4 years, so I waited and got the Pixel 4 XL.As others have said, it doesn't have the brightest screen, but I find it sufficient. The 90 Hz refresh isn't on all of the time by default unless you enable it in the developer options, which I did.I noticed that some reviewers (in general) were disappointed with the battery life, but it lasts me the whole day with my level of usage. I bought a pair of Seneo wireless chargers, 6' USB-C cables, and adapters--one for the home and another for the office, also bought the iOttie wireless charger for the car. Needless to say, I'm rarely below 80% battery.So far, the radar sensor is just a gimmick for actually directing the phone to perform actions since it's a bit sluggish even for skipping through songs or YouTube clips. But I do appreciate the fact that it lowers the volume of my alarm when my hand reaches over it when I go to snooze it!The camera quality is fantastic for photos, and it's decent for video, the stabilization is great.The face unlock is very fast, and yes, it can unlock with your eyes closed, and who knows when that'll be fixed. I have a twin brother, and his face is similar enough to mine (not identical) that even he could unlock my phone... Which brings me to my next point: I really dislike the fact that there is no fingerprint reader. It's annoying that most apps don't acknowledge facial recognition for app logins yet, so I have to resort to typing in the pin or password.All in all, if you love stock Android and are due for an upgrade like I was, then this is a very good phone! To be honest, I have been pleasantly surprised at how stable Android 10 has been so far.",1
5.0,"Perfect phone
  
","November 7, 2019",No,Amazing phone very fast and great camera,5
1.0,"I Really was expecting better
  
","December 9, 2019",No,"I am a bit of a google fanboy, so at the first sale, I bought the Pixel 4 XL as i had loved my 3XL i was using. I honestly did not expect to be as disappointed as I was. The speed at which I was able to unlock my 3XL is something i really miss. The 4XL is quick with the unlock sometimes, but half the time takes a second or two, which feels laggy for a $1000 flagship smartphone in 2019. The screen looks great, but not a noticeable difference from the 3XL. The camera seems no better than the 3XL. Honestly, I really REALLY wanted to love this phone. I just cant say its worth the upgrade if you have the Pixel 3XL. So if you have last gen's  phone, and you love it, keep it.",2
3.0,"Frustrating at time due to face unlock/no fingerprint, but good batter
  
","January 10, 2020",No,"Having had this phone for several months now, I've finally adjusted.The loss of the fingerprint reader was significant, and a big miss. Unlocking the phone via face recognition is frequently frustrating, and slow, much slower than the fingerprint reader where you can unlock before it's even near your face.It will frequently unlock itself when I leave it out in the sofa or my desk, also annoying.Camera is great, multimedia is great.The phone is too tall to use comfortably when gestutes are turned off, the stretch from top to bottom often means an accidental back button press as your hand curves over the bottom to interact with the top of phone.All in all it's good, but it's not the best pixel, and the high price is questionable given how good and similar the predecessors were",0
4.0,,"October 30, 2019",No,None,0
1.0,"phone vibration is virtually non-existent
  
","December 7, 2019",No,"I set the phone to vibrate on high for text messages so I can tell when I get a message if its in my pocket. The vibration was virtually non-existent (like a 1 on a scale of 1 to 10). same thing for vibration on ring. I called support and they had me do factory reset etc, no improvement. they shipped me a replacement phone. Same thing, vibration almost non-existent. I called again. This person tested on a 4 XL at support - and found same thing ie my phone wasn't defective they are all made that way. Don't know why no-one else I can find has mentioned this major defect. Don't know how they can sell a $1,000 phone that doesn't vibrate.",1
5.0,"Google's best yet..
  
","December 10, 2019",No,"Having owned all iterations of Google phones I would count this as their best. Coming from the notch-gate 3xl this is better on many levels. Better screen, cpu, more memory. Better camera. Wireless charging. Bigger battery which gives me 6 hours of SOT.The face unlock is superior to finger ID which gave me many false readings. The radar might be a gimmick, but it does sense when you're near the phone.Not a perfect phone, but a damn fine one.I waited and purchased the phone for $699.",0
5.0,"Great phone but wait for a discount
  
","December 2, 2019",No,"People need to stop judging the phone from reading other reviews. The truth of the matter is, sure, the battery could have been bigger but I've had zero issues getting through a day with solid moderate use. The phone is everything I would expect from a Google Pixel. Super smooth user experience. I would buy it again with no regrets.Again, truth be told, I purchased the phone for $250 off and have been very satisfied. I don't think the phone is worth $900 or $1,000 for the large model.",1
5.0,"Pixel 4 XL is the best phone for normal people. Not the geeks.
  
","January 10, 2020",No,"I purchased this through my carrier and I was on the fence with purchasing it because of all of the reviews on YouTube. I was coming from an iPhone XS and was sick of the expensive pricing of iPhones, iCloud Storage, Apple Care, etc...After 2 months of owning this device, I love it! The facial recognition is incredibly fast and I LOVE LOVE LOVE, the Soli sensor feature. Specifically how the phone senses I'm about to pick it up and lights up my phone to unlock quicker. The feature to gesture swipe songs away is nice but I barely use it. How it senses me is the best feature.I also love the camera. I'm no photographer but this photo always ends up being the life of the party among a few of my friends and family that still own iPhones. The added feature to take picture of the stars is so impressive!",0
2.0,"Battery needs charging multiple times per day.
  
","January 10, 2020",No,"None of the good features matter when I'm constantly having to charge the phone. I've had to buy additional chargers to keep around my work areas and in vehicle to ensure my phone doesn't die midday. I can actually watch the battery drain while I use it.  I've never had a high end phone that required multiple charges per day. Very disappointed.Also, navigating between open apps is problematic. Apps are navigated and closed by swiping up from the bottom. However, swiping up often just results in scrolling instead of the intended action. Consequently, it takes multiple attempts to achieve the desired result. Same with the side to side swipes to go backward/ forward. Storage isn't near sufficient, either.  But, yes, the camera takes great pics and the video/audio quality are very good. Would not buy again, would not recommend.",0
1.0,"Not great
  
","December 26, 2019",No,"Google pixel has got to be the worst phone on the market, my iPhone 2 was more stable.Where to start , the phone constantly crashes when trying to play games. When you open the browser 7 out of 10 times it will lag to the point where If you are playing music,the music will skip.The WiFi is terrible and im not talking about my wifi, I'm talking about the phones connection to it. Switching between the iPhone and Google pixel , the pixel will constantly drop connection and calls.Do yourself a favor and don't bother with Google pixel until they get better.",1
1.0,"can't see other devices
  
","December 24, 2019",No,"The cable to copy older phone is useless, says it can see it, then it fails and there is no way to go back. Had to chat with google to retry, multiple resets until it used the cloud.  Don't waste time with the cable.",1
5.0,"Overall it's a solid phone that is very enjoyable to use
  
","November 18, 2019",No,"Phone is super slick, very easy to use. Has poor battery life, but that's the only downfall I can find on it after using it for a month. Feels similar to an iPhone.",3
