5.0,"A great Phone at Black Friday Savings
  
","December 5, 2019",Yes,"I purchased this phone after reading/watching many.. many reviews on You Tube and the Internet.  I chose this phone for several reasons.  One, it came with great Memory right out of the box.  Two, no lag (very speedy between apps),  Three, the stylus is Great!!  I love to write notes and having extra features built into the stylus is just a bonus.  Finally the Screen itself is just stunning.  Pictures and movies are amazing on this display.  It's large... but not to large.  Even with the Phone protector (a Defender Otter Box)  on its really not that big and fits into my pockets easy.  I purchased additional memory for the already ample amount of memory that was on the phone already.  I just wanted to keep my books and movies separate.The primary reason why I got this phone is to replace my old LG Stylo 2.  This was a large phone as well with a stylus.  It had only 16GB of memory.  I had this phone for several years and it still works fairly well.  However, the battery was giving out on it and the memory was less than adequate.  These were the primary reasons to upgrade.  When I researched this phone I wanted one that would last several years again and have the memory and speed to keep up with future apps and software updates.  The Note 10 Plus just fit the bill.",3
3.0,"Disappointed with the deal I got from amazon . Bad packaging
  
","November 22, 2019",Yes,Galaxy note 10 plus is a great phone . I love the phone . But it was not what I expected . I was expecting a made in korea version instead I got a made in vietnam version. Disappointed as I ask the community they got the made in korea version . I bought this phone for 1099 usd when I check the price after 1 week price goes to 899 usd with a free samsung ear buds another disappointment.  Packaging was also not reliable when I hold the package box I could feel the hollow Ness inside no safety bubble wraps may be that's why there was these scratches on the box . Although phone is good but the deal I got was a total loss for me . That's why only 3 stars,5
5.0,"A great phone that will get better with updates
  
","December 26, 2019",Yes,"I normally don’t buy flagship phones upon release but decided to get the Note because I have never had the Samsung Note line but can use it’s features.First great thing is the S pen I had no problem figuring out how to use this and now wondering how I ever lived without it.I much prefer using the pen to go though apps and I am actually the type of person who like to scratch out notes on a piece of paper.I just think it stimulates the thinking process,and the pen is great.As far as no headphone jack ,I been wireless for so long now a cord just gets in the way and won’t miss it at all.  Android 9 and Samsung UI 1.5 are fine but the new update (whenever it comes ) makes this phone probably the best android you can buy.The photo proximity feature is really cool and useful for doing projects,and the new update will finally get a worthy screen capture of recordings.Something needed on the Samsung line ,along with other improvements.I paired my phone with a Gear S3 watch and this is probably the first time Samsung has not abandoned an older product.I much prefer the Samsung in style looks and notifications along with exercise and paying are really my main watch things.The battery is excellent,the screen is amazing I don’t even notice the little hole.Both fingerprint and facial recognition have worked well with me.  Super happy with this phone and would recommend it as a work or personal phone to anyone in Android/Samsung universe.The smart switch from my S8+ worked very well.And it isn’t too big still fits in a pocket on a front shirt or in the pockets of my travel bags.",2
5.0,,"August 25, 2019",No,None,0
4.0,"Love it but got a bad one?
  
","October 3, 2019",Yes,Already contacted Samsung support. Love the phone but when cleaning with micro fiber a part of the back gasket came off. So no water proof in that spot(problem). Seems to be a manufacturer fault. Hopefully it is taken care of. I should return phone for a new one but seeing a recommended Samsung repair tech first.,5
2.0,"Box was already tampered with and looked like a returned item.
  
","November 24, 2019",Yes,Box was already tampered with and looked like a returned item. I need a brand new which is what i paid for. The box seal itself was dirty and broken and phone almost slipped out of the box because of the seal.,6
5.0,"Best phone on the market!
  
","September 4, 2019",Yes,"My favorite feature is the MST technology in Samsung Pay. It makes Samsung Pay work at locations that Tap to Pay normally wouldn't work. Everytime I use it, it blows people's minds.",7
5.0,"Love it.
  
","September 25, 2019",Yes,"So far I love this phone. It's so pretty and it's super smooth to use. I mostly brouse the internet and stream movies. I'm upgrading from the Samsung Galaxy 9 and I'm glad I did. I can easily navigate presentations for my business. The camera is fantastic. I'm still playing around but I'd definitely recommend this phone. Also, I had no trouble turning it on with Metro by T-Mobile. I love a good phone but this company definitely gives the best value for multiple lines!",4
5.0,"Happy, definitely recommend
  
","September 23, 2019",Yes,"So happy, handles great. Lots of storage. Graphics fabulous!",6
5.0,"Temp plastic film over display is so inconspicuous you might want to not remove at all
  
","December 8, 2019",Yes,2 sim will NOT work even w  2 sim tray upgrade. ( a 5 dollar part)I did not think it was worth switching based on in store comparrison to my 9.It is def worth it after you use it a day.Super slow motion video only records like a second of video.  Amazing nite mode!  Wish they would include ir blaster and removable battery like note 4.  The curved screen is way less annoying than note 5All in all well worth the price.  It seems to work w verizon sprint tmobile att and their resellers like  cricket boost etc etc.  I ll let u know in a week if any problems.  It will not do 5G but i figure it will have good trade in value when 5g price drops this spring.,2
5.0,"Nice phone, but not perfect.
  
","December 4, 2019",Yes,"I upgraded from a Note 4 plus.  What a difference! I've been living the speed of the processor and it's got great memory space! The only thing I don't like so far it's the swype doesn't pick up the words I'm trying to type more often than my old phone.  I live the big colorful screen.  I haven't figured it all out yet.  I'll have to tell you more later... but so far I'm very happy.  Oh... one thing I do dislike is that there is not a normal hole for the headset.  The place you charge the phone its the same place you have to plug in the headset.  I found an adapter though that I've ordered,  but what do you do if the battery is low too? I think this is a design flaw.  However,  the battery life is good right now.  It lasts all day and I listen to audio books all day on this.  Also,  you can't easily open this phone and take out the battery.  So... if you are used to pulling the battery out to do a hard reset,  then you are out of luck! Also,  if your battery starts going bad,  then you are up a creek! So... you win some and you lose some.",1
4.0,"Amazon is infuriating!
  
","December 8, 2019",Yes,"The phone is okay so far but it was difficult to get the SIM card holder out.To order the phone I had to sign in three times, each time Amazon required me to retrieve a password from my phone that was barely working!!!!!!!!!!!!I almost cancelled the next order for the same exact problem.I have been buying from Amazon for many years and my original password worked fine for at least ten years.TRY TALKING TO A HUMAN AT AMAZON, YOU WON'T LIVE THAT LONG.I'm looking for alternatives right so commit with suggestions.",2
5.0,"Liked this more than anything
  
","September 19, 2019",Yes,Bought it through amazon bundle offer.  We loved the phone very much. We were using samsung galaxy s9+ before and face recognition is really quick on this when compared to galaxy s9+. Camera really gives us the best quality pictures. Will recommend this as best offer that which they are providing and also best experience can be gained from this Note version.,4
4.0,"Pretty disappointed
  
","October 24, 2019",Yes,"I paid $1100 for this and I still got bubble in my screen, I opened up the box and there were like carton pieces on top of the phone and there were fingerprints all over the phone. Also why doesnt the screen protector cover the the entire screen, kinda looked like my screen protector isnt for the note 10+ love the phone so far except for the bubble and how it was packed.",3
5.0,,"August 25, 2019",No,None,0
4.0,"Even Though I love my phone, I am not happy with the battery charging.
  
","December 12, 2019",Yes,"Update: Phone was replaced by a new one, and it seems as working better and it is charging faster than the previous one. I hope what I got is a great one. I really love the features of this phone.It looks and do what I great phone does, it takes amazing pictures and the technology is amazing. I am learning everyday new things and so far I love my phone.The bad side is it charges so slow so I am not sure if it is the phone issue  or the charger. I don't know what I should do in this case. :(  I would have giving 5 stars but I am not happy with the time charging because it takes forever. As I said I don't know if this is the phone issue or the charger.Update: I removed the screen protector that comes with it as I got my own and surprise! some scratches on the screen.  If I would have seen those before I would have returned it right away.",1
4.0,"Good but could be better
  
","December 22, 2019",Yes,"The good:-Really nice design and great looking phone-Probably the best hardware on any flagship phone at this time11/2019- fullscreen bezeless- large sturdy screen that's durable and the body is quite resistant to bending for a phone this size- supports adding sd card storage of 1tab sdcards extending the 256gb + 1tb total storage = you'll never have to worry about running out of room for photos and videos on your phone ever again- 4k video, slow motion, and super slow motion-video motion stabilization is really good- snapdragon 855 processor means its fast really fast- nice stylus pen and can act as remote for some phone functions like camera controls- it has a thin film screen protector installed by default- you can set default storage of camera and downloads to sdcard and save your phone storage- Multitasking is very fast and very smooth- wireless charging and wireless power transferThe bad:- The onscreen fingerprint reader sucks, it doesn't work with most screen protectors and even when it does it will fail at least 30% of the time and is exceedingly frustrating if you need to unlock the phone in a jiffy for photos or videos- the facial recognition so fails about that much and if you change your hairstyle or wear glasses and then stop it will not recognize you sometimes.- the facial recognition requires good lighting or it will fail almost 100% of the time in the dark, this means if you're out on the streets or at a festival with minimal lighting it will not recognize your face- it has a thin film screen protector installed by default that could interfere with additional screen protectors unless you remove it,  but you'd have to know there was one in the first place which is not mentioned- the default samsung camera software is inferior n picture taking to even the pixel 3 camera, I installed the google cam and use that instead of the Samsung camera in normal photo situations. The Samsung cam over saturates and loses detail in photos where the google can will capture more realistic results with more details and less photoshopped results that make the photos look almost fake.- The default samsung messaging app is also really bad, it will compress any images and videos to such a degree that it will be totally blurry of you send things over SMS. It will also limit the size you can send beyond what other phones allow. Images you send will be subpar and pixelated. I had to switch to the google messenger downloaded from the play store; it is superior in every way and I can send things over like I was able to on my iPhone; the quality is much better than the compressed mess the Samsung default message app was doing- the navigation swipes are hard to do sometimes due to the size of the screen and the keyboard layouts are not well designed for one handed use even in one handed mode, I had a much better one handed experience on my note4.- this phone is near impossible to operate with just one hand most of the time- the placement of the camera in the top left corner means when you try to take photos in landscape mode your fingers can easily obstruct a portion of the camera and show up in your photos.  They should've kept it like the S10 where it's in the middle of the phone so your fingers would be a lot less likely to get in the way of the camera lense.I haven't owned a note since the note 4, so for me this was a huge improvement in most areas and I was waiting for a fullscreen bezeless phone with an onscreen fingerprint reader so that's why I chose the note 10+ over the pixel 4xl. I also wanted the flagship phone with all the bells and whistles so I chose it over the s10+. I switched from a note to iPhone and being pissed at iPhone's limitations after 5 years, mostly related to storage and random apps disappearing into icloud, I decided I needed to go back to android and was waiting for the right phone.I am overall very satisfied with the phone in the $600-700 price range, but wouldn't get it in the $1000 range due to some big flaws I mentioned above. I'd buy this phone again in this price range because i still it's great and in most ways its superior to the pixel and iPhone, but I think samsung could've done much better on this phone  especially since this is their flagship model. Oh also Bixby is annoying and I turned that off right away. If this was full retail of over $1000 I'd sadly go back to using an iphone or pay $600-700 for a pixel 4xl.",0
1.0,"Buyer beware
  
","November 27, 2019",Yes,Will NOT work with XFINITY Mobile...huh  unlocked n bands are there  COMCAST sez NOT COMPATIBLE....WHO is the liar????,4
4.0,"Buy the refurbished. I own both and a IPHONE also
  
","December 22, 2019",Yes,I bought both and the second was a refurbished. I could not tell a difference and paid $680 for the same phone that cost $1100.  Definitely get the refurbished.  Get a warranty still and heck you save big bucks. Unless you got it on Black Friday for $850 with my amazon CC I got another 20% off.  Nice.  I own both the IPHONE and Samsung and use both. Switch SIM cards when needed.  Wish I could have to Sims with same number lol.Reason I got the Samsung was the DEX  and using my TV as the screen. And the android apps I have certain apps that work on Samsung vs IPhone. Watching movies and NFL games on phone then stream to my tv.  Still figuring that out,1
4.0,"They should quit bothering with earbuds.
  
","September 29, 2019",Yes,"Phone is great. Earbuds are pointless because they go quiet in one ear after a few months, same thing happened with my Galaxy Note 9 earbuds. They should just stop including them and stop ""updating the firmware"" for them.",5
5.0,"Get some....
  
","January 8, 2020",Yes,"Like many of the others who like this phone we can't say enough about it either.One note about it would be the importance of getting all the Samsung App updates, Play store updates and then finally the 2 major updates for the Android system, and the final updated to the 1st.The features are by far to many to list here, that make the Apple I phone look like crap...Everything came in the box and it is a brand new phone. We use TelTik for all our business T-Mobile accounts so you might want to give them a look, as the rates are the best in the USA. You must at least have a business license to get those great rates however.Lastly it is highly recommended to leave the factory glass protective cover on until you ""MUST"" replace it, and protect your new Samsung Note 10 Plus ""gem"" with an Otter box case cover also available on amazon and elsewhere...The phone is unlocked and it just a joy to use here at work and home!Otter box... It's pure protection so get some!",0
3.0,"Limited bloatware but carriers don't like that
  
","December 30, 2019",Yes,"I did not do enough homework before purchasing this. I have terrible cell coverage at my house for all carriers. I'm relegated to relying on Wi-Fi calling to be able to send and receive calls reliably from my house. because this phone is unlocked, my carrier will not support Wi-Fi calling even though they sell the exact phone and you guessed it, if you buy it from them, Wi-Fi calling works. visual voicemail is something I liked, so I was very annoyed to see that you also can't enable that. clearly this is not a problem of the phone, it points to the greed and control of the carrier's out there. if you're like me and must have Wi-Fi calling, then do not purchase an unlocked version of the phone. That said, the note 10 plus is arguably the best phone ever, so fast and so many great features; I love it!",0
1.0,"SELLER UNRESPONSIVE - REQUESTED REPLACEMENT
  
","January 2, 2020",Yes,"How long should it take to review a replacement request?  Since I got this phone, the moisture detection alert turned on although it was never immersed in water.  I have used a cold air flow to attempt to dry the port out, and have also completed a factory reset on the phone as suggested on the internet.  This is a new phone.  I have filed a replacement from the seller and it sits in ""review with customer service"" - I need a dependable phone.  Hopefully they are more responsive to bad reviews.",1
1.0,"Not good customer service
  
","October 21, 2019",Yes,So Delay f***** booring,5
1.0,"Premium Phone with Worst Amazon &amp; Samsung Customer Service
  
","January 8, 2020",Yes,"I have purchased this phone on November 21st 2019, received on November 23rd 2019. start using the device from December 2019 as I was out of town.From Day 1 S Pen is inside the phone, and I hope if it's inside the phone then it's charging (if you don't put the S Pen inside the phone then you will get notification/remainder about S Pen is not in the phone). after couple of days of use I thought let's use S Pen to take picture(one of the key feature) but for the surprise S Pen pop up windows showed battery of S Pen is less than 1% and requesting you to put it back inside the phone. which I did and then later it was showing it will take few minutes to get it ready to use. no matter how long you keep S Pen inside the phone every time it's shows battery of S Pen is less than 1%.At this moment I decided to give a call to Amazon customer service, after explaining the whole situation to agent he insisted to do conference call with Samsung support. now we explain to Samsung support entire issue. the agent from Samsung did some triage over the phone and realize that best thing to do is to send replacement  S Pen. so he open Samsung Care support ticket  which require me to send them proof of purchase receipt which I have provided. now Samsung agent said they opened the ticket and I'll get automated text with tracking detail.After one day of waiting I have received automated text which has link for tracking when I opened the tracking link I have noticed that Samsung declined to send replacement S Pen. I was like why, I purchased the phone from Amazon with 12 month US warranty and now Samsung is not validating the warranty.I called Amazon again about this issue and explain that Amazon selling the product ""falsely"" Advertised as it says 12 month US warranty but Samsung is not validating it. Amazon simple said we will refund you the money if you send back the device.Now I'm in the situation where neither Amazon nor Samsung is helping for nearly one month old brand new phone.",0
5.0,,"August 25, 2019",No,None,0
5.0,"IMEI doesn't work in every country!
  
","January 6, 2020",Yes,"Samsung Galaxy Note 10+ (unlock-phone) is definitely a perfect smart phone, I purchased it; but I had to return it since US Product Phones - such as this Note 10+ - will not work in Indonesia due to IMEI restriction and registration to the Office of Ministry of Communication and Information Technology Indonesia.  So SAMSUNG, I am sorry for returning this US Product phone.If you guys try to purchase US product phones, please be aware that not every phone will work in every country, unless you keep SIM Card of your US provider with it and better to check it out with local provider prior to your International departure. Just an advise!",0
5.0,"If your looking for an upgrade, get this phone
  
","December 27, 2019",Yes,"There is really only one negative thing that I have to say about this phone.The finger print reader is good, but it isn't perfect,  sometimes it is slow. Use the face reader ifbit REALLY bothers, its MUCH FASTER!After this it is only positive!1. The phone never lags, ever! Even when under high stress (having dual split screen + app pop ups! Though some may never use this feature, it is highly practical!2. The display, oh my the display. Samsung usually has the biggest and brightest display of the entire phone industry and this device is King of 2019 displays. When watching videos to viewing photos, this phone's display is gorgeous!3. All of Android One UI secret features and customization - The Note 10+ is brilliant when it comes to Customization and building your phone to your preferences.  If you can imagine something,  you can probably customize it. Ive gone through customizing certain things about my phone several times throughout the past 4 months of having it, and IM STILL finding new things to change! For example, recently I wanted to change the shape of my apps on my homescreen and I found that I could by turning on the Devleoper Options. Its really spectacular what this phone can do.4. Battery life - what's to say that hasn't already been said? The battery, even under full blast ""high performance"" mode will last you all day.Pretty much it comes down to this:Have a phone thats 2+ generations older than the 10 series? Get this phone. Want to go from a Galaxy s9 to the note10+? Get this phone. Want to switch from iPhone to Android for more customization... GET... THIS... PHONE!I havent even discussed the s-pen yet which is the whole appeal of the note series, but it is fantastic!",0
3.0,"Box was open when it arrived, but great phone.
  
","January 2, 2020",Yes,"I took points off because the phone essentially arrived as an open box and everything had been knocked out of place inside. That is purely against Amazon for that, not Samsung. Despite this, the phone itself arrived in new condition.As for the Phone itself: Overall 4.5/5Pros-Screen is beautiful and vividPhone is large, but not uncomforable (this is case-by-case as I have large hands)Phone is extremely fast and responsiveBattery life is very good, I don't need to charge my phone before I leave work anymore.S-pen is a great addition and I love taking notes while the screen is off and lockedCons-In-screen fingerprint scanner is not nearly as fast or reliable as the one normally on the backNeither here nor there-Facial recognition can be duped, but I never use it as I prefer fingerprint readers, because I don't want to pick my phone up every time I use it.Overall, I am happy with the phone, but not with Amazon since somehow the sticker came off before or during shipping allowing everything in the box to move around.",0
5.0,"Pleasantly surprised.
  
","January 3, 2020",Yes,"I bought this a little sceptical. I'm a die hard Huawei fan. Just wanted to give this Samsung a trial. I'm not disappointed. Battery outlasts my Huawei Mate 20x5g,which is pleasant surprise. Given what people complain about in Samsungs. I enjoy the pen remote operation of the camera for group selfies. Facial recognition works fine, even in low light.-Beats Huawei in this as well. My only complaint is the email app in Samsung is not my taste. I give to my Huawei.",0
2.0,"Be AWARE!  Missing features!
  
","November 30, 2019",Yes,"Unlocked phones are not always an advantage.  There are several features disabled on the phone like VIDEO CALLING, that are provided on the regular network phones and there is no way of enabling them.  THIS SHOULD HAVE BEEN  PROMINENTLY indicated on the description.  There is workaround for this but not a clean alternative.  I would have expected to have features that were standard on my 3 year old S7.  If you can live with this shortcoming, it is a nice phone.",1
3.0,"Think before you buy
  
","October 23, 2019",Yes,"Although you might like the huge screen, its definitely not worth 1000 bucks. There are other phones which are worth a lot less but have better battery life and camera. This was my first samsung galaxy note and it was not as good as i expected it to be.",3
5.0,"My Dad loves it!
  
","December 2, 2019",Yes,"My Dad loves it already and he has yet to activate it! Good first impression to him considering he had an iPhone 6s before I got him this phone. If it turns out to be defective I'll be sure to change this review, but until then: nice phone Samsung; well done!",1
5.0,"Great phone, great deal. Love it.
  
","December 1, 2019",Yes,"I'm not sure where the poor reviews came from for purchasing this phone. The phone is stellar. It's fast, lots of storage, great camera, huge beautiful display. I received it without a single scratch or torn packaging. I move everything from my Note 8 in about an hour via smart switch sitting in my living room. No problems like some of the reviews I have read on this phone. Totally happy and it was a great deal.",0
