5.0,"Literally amazing- buy it, don't think twice
  
","December 28, 2019",No,"First off, this thing is enormous. It has a massive 6.8"" 3040x1440 OLED display that is simply stunning. The clarity, color, contrast, everything is perfect and it actually reminds me of what the giant OLED tvs by LG and Samsung look like in terms of those things.I'm much of a tech collector and my phone before this one was the LG G8 ThinQ. It has the same chipset as this phone yet, this one is so much faster. I mean it literally scored almost 50,000 points higher on AnTuTu for me.The battery life is fantastic. The battery isn't massive and it's certainly not the biggest out there but with some background app restrictions in place it will easily go a whole day of medium use with battery to spare.The cameras are great, I think the main shooter on the G8 was slightly better but this phone has 3 of them. Main, wide, and telephoto. The telephoto lens is really fun to play with and can make some awesome shots.The build seems very solid. Even though LG's high end phones are often made using military grade durability tests, I feel safer with this in my hand than I did with the G8.As I said, the display is massive, color accurate, and sharp. Streaming media on it is a surreal experience. You're close to the screen size of a small tablet but can still hold it in one hand. I watch Netflix, YouTube, and stream my PC to it via nvidia gamestream. (Also, if you get at&amp;t's unlimited elite plan, you get HBO GO included 😉)The only gripe I have with this monstrosity is that it has no headphone jack. I suppose there is room for understanding with the regular note 10 but this thing is massive and on the bottom near the call microphone I'd say there is room for a jack. I use wired headphones because they simply sound better. You can't get better quality than a hard connection. If you also use wired headphones I suggest a HiFi Bluetooth headphone amp such as the FiiO BTR3, which is what I use.You know you want it. Buy it. I'm broke now but I'm not complaining. Bad financial decisions keep life alive :)",0
5.0,"Best note ever
  
","October 9, 2019",No,Great device battery life is amazing 2 days without having to charge the device. Great camera. The Screen looks outstanding,2
3.0,"Design flaw -pen holder
  
","September 11, 2019",No,This device has a design flaw where the pens are following out randomly.  Walked around with the phone for a day and lost the pen without even using.  Samsung will help.  Blames people for the pen.,3
5.0,"Sorry I bought the S 10+ missed this
  
","August 25, 2019",No,"Excellent, Beautiful, great features. is this 5G I want a 5G Samsung",2
5.0,"All about the note 10 plus!!
  
","October 7, 2019",No,Best phone on the market as of now. Fest phone. Best camera. Long battery life. Amazing look. Basically it's an all in one. you got everything you need in that phone ❗❗❗✅✅✅✔️✔️✔️,2
5.0,"Best Samsung Phone Ever
  
","December 4, 2019",No,"Amazing Screen, Battery Life, S Pen, Fast Charge  I have this phone for 2 weeks just love it.  Samsung got it right get it &amp; you will be happy",0
1.0,"Was disappointed...now angry.
  
","January 4, 2020",No,"Gave as gift and was there when he was disappointed thinking it was refurb  since it had been opened...missing packaging like screen and ps wrappers and any doc.  Returned in orig box and paging Dec 26.  No acknowledgment and status says ""Waiting for your return..."" same as day he shipped it.",0
1.0,"Screen scratches super easy
  
","January 9, 2020",No,Your screen will get scratched just by the meat force of the wind as u hold ur phone. These galaxy screens are the cheapest poorest worst screens in the history of man. Samsung should be ashamed of themselves for making such a baby soft screen it’s mind blowing. It doesn’t make sense. You suck Samsung,0
5.0,"Bought it to take selfies
  
","October 21, 2019",No,"5 stars, superb selfie camera as you can see",1
2.0,"Too many bugs
  
","December 2, 2019",No,"It's not what I was expecting. Hate the curves now that I use it. Everything on it seems off. Battery runs low too quickly, GPS is way off all the time, issues with games constantly. Lemon.",0
5.0,,"August 25, 2019",No,None,0
5.0,"Good Smartphone
  
","December 26, 2019",No,Very good product. Very nice and very beautiful.,0
5.0,"Nice package
  
","December 7, 2019",No,Nice,0
5.0,"Universal File Storage 3 is FAST
  
","August 28, 2019",Yes,"The Note 10+ may be the best phone ever...  and not for the reasons you think!The Note 10+ has UFS 3.0, a first for Samsung and this thing flies!  Universal Flash Storage 3 is not only over 2 times the old standard (2.1=1200 MB/s vs 3.0=2900 MB/s) but it also has lower power consumption.  So far app and game launches are blazing fast.Time will tell, but with these whopping storage options, 12GB of Ram and 4300mAh battery, this beast is going to keep going and going!And when you need to charge it, Fast Charge has you covered.  HOWEVER, for even faster charging, get a super amped USB-C charger (87w/90w).  I’ve got one for my laptop (ordered from Zon) and it feeds the Sammy 10+ faster than the included adapter.When my Note was at 75%, the Samsung stock adapter showed 41 minutes to full charge.When I hooked it up to my USB-C brick charger, it stated 36 minutes but was done in 33!  (I was not using the phone at the time).  So if you want faster you can get it.Wireless charging worked great, with and without a few cases I tested, along with my magnetic chip insert, it didn’t get in the way.In the box:-Phone-USB-C Charger with 3ft cable-USB-C AKG Headset (sounds fab, rubber like cords near ear and mic, soft braided cord going into the phone)-Extra Ear nubs (S/M/L)-Some documents which in the picture you will find a key one...The Note 10+ Unlocked comes with a screen protector!  What a great surprise.  It’s always a challenge getting good EDGE coverage on a 3rd party glass or skin.  This one is tight.  I wouldn’t have known right away had it not included the paper telling me so.  I’ve included some pics (with some dust to show contrast hah).  Over the top couldn’t be happier with the phone so far.You have camera and fingerprint sensor embedded in the screen as advertised, but also a hidden top speaker.  With the bottom and top speakers going the phone presents quite well.Be sure to turn on Dolby Atmos in the toggle section right away to get the hidden speaker to perform even better.I’ll post in comments if I have any more revelations (or insight to testing DEX software integration) or if you have questions, something you want me to check out, let me know!",19
3.0,"Pixel density and screen are awful.
  
","September 2, 2019",Yes,"As a Note user since NOTE 2, with 2 or 3  Galaxy Note's in use at every moment (I use 3 lines, all with Notes, always) here are my thoughts:1) Buying experience and seller 10/10. (I bought a U.S. unlocked note 10+).2) Experience UI 1.5 is a serious downgrade from UI 1.0.3) I replaced a Note 8 with the Note 10+ while I am using 2 Note 9's. The pixel density and color reproduction going from 500+ pixels to 400+ is so obvious, the Note 8 was light years ahead in color. No comparison to the 9. It's night and day. Even my Note 4 of yesteryear had better colors. All in FHD+ BTW. For $1,100 I expected better Samsung. Sad to say, if I did not need the features such as Write On PDF and Hancom Office Editor, and hated the return process to boot, I would have returned the Note 10+ for another Note 9.4) And Samsung, why do you include a 15 watt charger, with extremely fast charging capabilities but you include a 2 feet long cable for $1,100? Are you guys serious? 2 feet are useless!!!! Keep it up and soon you will only be selling series J and series A. Sad to say!!!! Color reproduction and pixelation is simply HORRIBLE!!! FROM A LOYAL NOTE USER.",16
1.0,"I bought the new note 10 plus as a gift for Samsung so they can keep it
  
","November 27, 2019",Yes,"I preordered the note10  plus so i could receive it soon as it was available for shipping. When i received the device it was new looked nice. As i was getting familiar with the device I kept seeing the commercials about the 30 min fast charging. I noticed mine would take over 4 hours to charge from maybe a 10%percent to get back to 100%. After messing with the settings, and knowing that 5G connectivity is around the corner if not already available in certain areas. My device said auto connect to 2g and 3g, with the majority being connected to 2g. (I did not purchase the 5g model) I called Samsung, they had me chat with a representative through text. This device is supposed to come with a 12 month warranty but they acted like I did something and am trying to get over on them. They asked if I'd dropped or exposed the device to water more than a few times during the chat session. Didn't offer any type of repair or exchange.  They walked me through numerous trouble shooting options. (Factory reset) That didn't work so they gave me information to one of their connected repair shops. I took the device in and immediately the gentleman said that sounds like a software issue and here we do the physical things like cracked screen etc. I call Samsung again get passed the chat process finally talk to a real person. This representative was nice, but the same questions about dropping and water exposure. Explained the process I've already been through, finally agrees to get me a shipping label since other options haven't worked. They required me to send charging cable and (my sim card) already explained that i tried numerous sim cards even a different carrier since it's unlocked, (a guy from work let me use his real quick)  same issues. I sent the item, received email updates about the status, like they received it, it's being worked on etc. It was returned with a note explaining what they did to it and that issue was corrected. Immediately I noticed they hadn't addressed the connectivity issue only charging problem. I had to wait for the battery to die down to see how long it took to charge. Remember the commercial said lightning fast 30 min? Well mine still took over 4 hours to fully charge. I received a survey by email asking how did we do. I was honest and was not the best review stated my unhappiness about all the hoops that I have to jump through and after paying over $1200 I still don't have the device with the capabilities I thought I purchased. Received an email with a small apology and said ship it to us once more and we'll replace the device to make it right. I did that and it's been around 3 weeks and iI have no confirmation emails with status updates. I tracked my package through UPS and it was delivered and received.  I finally called and they told me they had received it (two days later than UPS records) No further information since they barely received it. I called again and asked they informed me they have to take it apart to find the problem. I said I was told to send it back to get a replacement. They said no they are going to inspect it for water damage or evidence of dropping, and they are going to repair it if they deem it can not be repaired they will send a replacement. Also they said the connectivity issue was not addressed because I refused to send in my personal sim card. I still have no status updates of any kind no emails nothing. So my advice is not to deal with Samsung directly and to go to your carrier where they exchange them easier and let them deal work Samsung. Im extremely disappointed with Samsung over this ordeal I started with the S5 and have bought galaxy exclusively for my family over the years including tvs and a refrigerator. Now that it was time to upgrade the kids s7 edge and s8 active I let them both go to the dark side and get Iphones. Didn't want to Jane to deal with this issue 2 more times. I was supposed to give my mother my S10e when i got the note 10 plus but not due when that's going to happen so most likely going to use her upgrade to go apple they have a lot better customer service.",10
1.0,"This new phone ain't new!!! 😡
  
","September 23, 2019",Yes,This was supposed to be new but upon opening it found scratches on the screen. I can't send it back because then I will have no phone and lose my number. Super pissed off!!! I paid a crazy price and worse I switched from a new unscratched 256 got get this 512 version that is beat up out of the box.,12
1.0,"Unlocked phone terrible experience on Verizon, VERY UNHAPPY, a big downgrade from my Note 4! BEWARE
  
","October 22, 2019",Yes,"Can us the My Verizon app on this phone, No visual voice mail from Verizon, I though I was getting a upgrade from my Note 4 but VERY UNHAPPY with the way this works on Verizon. If you want all the features Verizon has to offer my understanding is you need to get a Verizon Phone.",8
2.0,"Great phone when it works. Top 4 complaints.
  
","November 14, 2019",Yes,"I have had this phone for 90 days and have the following issues:1. Sticky volume and power buttons. I have always had it in a case and never touch water or any liquid. This is super annoying since I commute to work and listen to music on a regular basis.2. Fingerprint scanner is subpar to apple. It reads 3/5 times.3. Facial recognition is also subpar to apple. 4/5.4. Some websites and apps aren't configured for this large of a screen (S10+)Other than those complaints, the phone and camera have been good.I hope Samsung can fix these issues...",4
5.0,"BLACK FRIDAY!!
  
","November 26, 2019",Yes,"What a great phone!!  I don't think it's worth $950, I mean no phone is...but the current Black Friday deal for $750 + Samsung Galaxy Buds means this was totally worth it. No 2k display or MicroSD expandable storage compared to the Note 10+, and a smaller battery.  Even at its normal price, 256gb is very generous considering what Apple charges for 64gb. This smaller Note 10 easily fits in my hand, and my pockets, compared to most phones these days. Had several updates waiting, and this is on the November '19 security patch. Android 10 has been confirmed to drop in January 2020 for the Note 10's, so bonus there!  Excellent phone with top of the line specs, so don't hesitate if you're on the fence ... try and get it on a deal whenever possible, cause who wants to pay close to $1k these days!!!",3
1.0,"Arrived in damaged condition
  
","November 15, 2019",Yes,The phone has scratches. I returned it and waiting for my full refund. Very disappointed.,7
5.0,,"August 25, 2019",No,None,0
3.0,"awful fingerprint reader
  
","December 5, 2019",Yes,"as a note user since note 4, i have always count on Note series to be one that has all features and improve up previous generations. this is simply not true for Note 10 +, let alone note 10.start with the positive. the infinity O display is brilliant. i thought i would be bothered by it as a note 9 user, turns out i don't. the cut off is tiny and quickly disappears in my view when watching video. the cut off nicely aligns with the other status display and does not cover any information during regular usage of the phone.  this allows the Note 10+ to pack a 6.8 inch screen in the same size body as note 9 while being a bit slimmer.UFS 3.0 storage is fast.  very fast, iphone fast.the phone came with screen proctor pre applied.now the negative.finger print reader sucked big time.samsung is the about the only company that i know uses under screen ultra sonic finger print reader from qualcomm. all other manufacture uses under screen optical finger print reader.  let's just say Samsung's experience sucked big time.  the reader is unreliability, tiny, poorly indicated and awful. the hardware is at best still in Beta testing, if not alpha testing. this is not the maturity i come to expect out of Samsung product. quite frankly, they should drop this gen 1 product completely and use the tried and true solutions.loss of 3.5 jack. there is no reason not to have the 3.5 mm jack. the jack is useful not just to listen to music, but also used for selfy stickers, micphones and whatnot.  bluetooth headphone, while nice, are still experiencing latency issues.it is a nice phone, but comes with compromises, note series shouldn't compromise.",1
5.0,"This is the phone you want
  
","December 12, 2019",Yes,"This phone is amazing!! I'm still learning all the features but for what I've learned and used so far I'm very happy. The camera's are absolutely fantastic great picture quality and the video features are awesome as well. I am still trying to get used to not having any buttons on the right side of the phone and having to go through the dropdown menu to shut the phone off, but I'm getting better at it. Let's talk battery, the battery life on this thing is insane, I can charge the phone to 100% use it all day, video's, music and normal web browsing and social media and by the time I'm home for the day it has only dropped to around 68% to 74%!! With the fast charging accessories that came with it, the phone charges from 0% to 75% in just over 35 minutes  and fully to 100% in just over an hour and 15 minutes. Well worth the investment. Storage is definitely not a problem with a staggering 256GB with the possibility of up 1TB!! I love this phone and am so glad I purchased it, if you are still trying to decide, stop trying, just buy it you won't regret it",2
4.0,"Great phone with weak cellular reception
  
","December 1, 2019",Yes,"I recently purchased the Galaxy Note 10 Plus and I have to say that the phone is amazing. The overall built quality is excellent, an immersive 6.8 inch display with great battery life, and super loud stereo speakers. The only problem I had with this phone was the cellular reception and how weak it was compared to other phones I have. I know is mostly the carrier’s phone for the overall reception, but compared to my OnePlus 7 Pro the Note 10 Plus doesn’t compete with signal. I believe I had a defective unit because the antennas on the Note 10 Plus cannot be so weak so that’s the reason why I returned it.",2
5.0,"Awesome new Note with a couple caveats!
  
","January 2, 2020",Yes,"Really happy I got both the 256gb option and the Aurora glow which was previously only available through Samsung only. Saved me over $400.Pros: camera has lots of new functions greatly improved over my sgs 9+ like 3D scanner (needs app download), live focus video, Ar doodle finally and zoom in audio for those that like added video options. Lastly the battery life is a big plus with the 4300mAh battery.Cons: keyboard sensitivity greatly changed over previous Samsung products so takes a while to get used to. Prepare for a lot of typing errors and misspellings. **really miss the 3.5mm audio jack. And to make matters worse, only a digital headset will work when connected into the C port. You cannot use splitters to share with a friend while watching video unless ots digital $$$. No more gas station or tjmaxx walmart replacement Jack's for those last minute moments you realize you left your samsung headsets at home.",1
3.0,"Should have kept my S9 plus
  
","December 14, 2019",Yes,"Samsung took more of my usefull features away than it added . Problem 1: Fingerprint reader is not sensitive enough to handle a screen protector. I used 2 different cheap stick-on protectors, then splurged for dome glass. Still not sensitive enough to work reliably. S9 plus had a dedicated reader in the back, but it always worked. Problem 2: no 3.5 mm headphone jack also means no access to the built in FM receiver. Problem 3: No magnetic charging base possible due to interference with the  s pen. Problem 4: Minor issue, but after powering on and removing the lock screen it once again continues to finishing powering up for few more seconds.",2
5.0,"Fantastic Premium Android Phone
  
","September 11, 2019",Yes,"As a long-time user of off-brand or not-quite flagship phones, I have truly enjoyed the ""premium"" build quality and feature set for the Samsung Galaxy Note 10+. I have come close to buying a previous note generation several times in the past, but never pulled the trigger. I feel like waiting for this generation was a good point for me to buy in with the screen-to-body ratio making the phone seem much more manageable (I have medium hands) than the screen spec might suggest. I find myself using the s-pen most when trying to get things done away from desktop or iPad Pro w/ keyboard. Its great to facilitate productivity and I like to type with it using the swipe keyboard feature.  Can you get a better value somewhere else? Sure, I did for years. Can you get a better big android phone? Probably not with exactly this feature set. I'd recommend if budget is not a huge factor and/or you plan on holding on to your next phone for a few years. YMMV, but I enjoy my new note.",1
3.0,"Not dual sim and so-so camera
  
","November 1, 2019",Yes,"Bought the phone for dual sim and camera mainly. I travel a lot so dual sim is important. Well, dual sim function is not supported. Phone came with a sim+memory card slot. I ordered a dual sim hybrid card slot from Europe and still it would only recognize one sim.  Camera is not even on par with competitor. Image quality is very so so and lots of noise especially in low light conditions. Don't trust the youtube comparisons.  The screen is beautiful and the pen is nice as usual.",3
5.0,"Beautiful phone
  
","November 27, 2019",Yes,"I just got this phone. So far I love it, the colors are so clear and vibrant!  I can't wait to use the camera, what little I've done with it is amazing.  I've had several Samsung phones and for the most part they have been awesome. Even though they did away with the headphone jack you can still use headphones if the cord has the c end on it.  Or with bluetooth headphones. The samsung earbuds that came with the phone are awesome too.  The Note 10 + is a beautiful large phone.  Not a phone to fit in your pocket.",2
3.0,"Underwhelmed
  
","January 5, 2020",Yes,"For the past two years I've been using the Moto g5... practically the cheapest smartphone I could find. Other than the camera it has been a perfect phone. I upgraded to the note looking forward to finally having a great camera and figuring that at the price point the phone in general would be a super nice upgrade...all in all I am disappointed. It feels way too big (that's on me, I got the +), the keyboard is terrible, it seems to lack a lot of the simple conveniences the g5 had and the camera so far has not been worth the cost--it seems to over correct people and their faces which is especially bad looking if there's any sort of movement (I bought the phone to take pictures of my kids so there is always movement...). Debating sending it back to try a different flagship phone...",1
1.0,"Phone might be OK but amazon ships unsealed boxes as new
  
","December 4, 2019",Yes,Ordered 2 and both phones’ boxes were unsealed with phones and accessories floating in the shipping box. Other companies such as Samsung and Microsoft ships the boxes sealed from factory making sure that the contents are not tampered and not risk the contents being damaged during shipping.,3
5.0,,"August 25, 2019",No,None,0
4.0,"From iPhone 7 plus to Samsung note 10
  
","December 11, 2019",Yes,"After more than 8 years using iPhone I decide to give it a try, it's been two weeks and so far so good, I thought it would be harder to adapt, I love the huge screen, I love that everything is customizable, the s pen es amazing and writes super smoothly, I'm liking android and I plan to jKeep the device at least for a couple of years, the only thing is a pain in the xxx is the fingerprint reader, at the beginning it took me at least 3 to 4 times to get recognize, now it has getting better and better, still sometimes won't recognize my fingerprint, I recommend this device to anyone looking for high tech productivity phone",1
5.0,"Great value by Amazon Warehouse
  
","November 30, 2019",Yes,"Samsung Galaxy Note 10+ Plus Factory Unlocked Cell Phone with 256GB (U.S. Warranty), Aura Black/ Note10+Sold by: Amazon.com Services, IncCondition: Used - Very Good - Item will come in original packaging. Packaging will be damaged.Order SummaryItem(s) Subtotal:$764.99Shipping &amp; Handling:$0.00Amazon Warehouse:-$153.00Total before tax:$611.99Estimated tax to be collected:$52.02Grand Total:$664.01For this amount of money, this is a steal! The phone came in PERFECT condition, in spite of being sold as Used. Even the plastics were on it, the first buyer did not take them off. No complaints whatsoever, so happy to get this deal. $500 off of MRSP $1100. Thanks Amazon.My only complaint is the gimmicky fingerprint reader. I'm using it with the factory screen protector and it still functions 50% of the time. Face recognition works good though, just looking at my phone instead of bothering with the fingerprint reader. However it's a pain in the back if you need to unlock the password vault or wallet...",1
5.0,"Great experience with my new phone
  
","December 8, 2019",Yes,I was  skeptical about buying the phone from Amazon.  Phone arrived in perfect condition. I was able to transfer my SIM card from my old phone  with no problem and the phone was $200 cheaper than  my mobile phone carrier.  I also appreciate that I was able to purchase a protection plan through Amazon. I am very pleased with my purchase!,3
5.0,"Computer in your hand
  
","September 22, 2019",Yes,this is an early review and I reserve the right to change it and probably will I've only had the phone for a couple days now but I'm absolutely amazed by everything so far and think it was worth every penny,3
