Rating,Title,Date,Verified Purchase,Body,Helpful Votes
1,"Sounds great but connection is a true nightmare
  
",12.Mar.19,Yes,The sound is amazing. So much better than my Echo speaker (obviously.)The connection gets worse each day. I never had any problem with a device staying connected to my network so I_ not sure If I got a defective one but I_ about 2 days from returning this. The sonos app is terrible. I wrote to them for help which is my last try before returning. This speaker won_ stay connected and then the process to get it reconnected only works if I unplug it and connect it directly to the router. If you are planning on keeping it right next to your router maybe it would be tolerable to constantly go through this?Alexa is slower to respond on this device as well.,117
5,"Quality Speakers!
  
",13.Mar.19,Yes,"Update:I_e loved this speaker since I purchased it. I haven_ experienced connection issues like others.My experience has improved ten fold with Google Assistant. Alexa sometimes needed a reboot after voice went offline. Not once with GA. I have both Alexa and GA powering my setup. Best of both worlds.I can't compare this to the 1st generation Sonos One, but I know it now has BLE and a faster processor. The sound is clear. I also have multiple Play One speakers... Not a big difference in sound.My purpose in buying was the ability to use AirPlay. Playing music from a wider collection. Not locked into a specific app when playing from multiple libraries. Then the ability to group my nom AirPlay speakers.The biggest plus for me... Not only can I group all my Sonos speakers. I can also play through my sound bar that is connected to my Apple TV 4k. This has given me the ability to play the same music throughout the entire house. Extremely easy to setup. I haven't experienced any dropouts. Strong signal from all access points.I love Sonos for producing quality speakers. Easy to setup and use. For a blind individual like myself, this is appreciated. I love tech, and gadgets.... It's refreshing when a manufacturer produces a product that does what it says it will.I can definitely recommend this product.",67
3,"Great sound, but Alexa integration needs work
  
",18.Mar.19,Yes,"The sound quality is great, far better than any other smart speaker I've tried, but the Alexa integration is awful. It won't respond to voice commands the first two or three tries, and the audible chime doesn't seem to work half the time. Hoping it's a software issue that will improve over time, but given the One has been on the market for awhile, not hopeful.",24
5,"Impressive loud sound
  
",20.Mar.19,Yes,Alexa works seemlessly with speakers. I have a pair that I use for surround sound with a playbar. They can get REALLY LOUD but don_ lose sound quality. Expensive but I know I_ getting the quality.,1
5,"Best speaker ever.
  
",22.Mar.19,Yes,Sounds great easy to load songs on to the app.  Love it.,2
2,"False Advertising Alert!
  
",25.Mar.19,Yes,"I bought a few of these sonos gen 2 units and set them up. Easy breezy to do. Ran into a small hiccup with setting up Alexa but that was user error and I figured it out. It_ just a multi multi multi step process I wasn_ anticipating. The speakers are great. I love that I can take calls and not rely on regular Bluetooth speakers. However! I bought these with the intention to not have to purchase the amazon echo or dot or whatever because of sound quality. I_ finding that the Alexa function is incredibly limited. It WAS advertised that Alexa voice calls were unsupported. BUT it had no mention of other things, such as routines and other automatic processes. Why can_ I have an Alexa Routine work with SONOS? That_ one of Alexa_ features that are wonderful. Aaaaaaand now I have three speakers that are as helpful as coasters, in my opinion, with simple functionality that isn_ possible. This unit is 10 stars if they can fix with a firmware update. Otherwise I will likely send them back. It_ just not worth the cost to have limited Alexa functionality. It_ pitched as _se Alexa for everything but voice calls!  Not true.Update: after three days? All of the speakers are out of connection and don_ work with Alexa or playing audio in general. I think there is a bug they need to fix where the device doesn_ connect to WiFi properly. I_ no tech wizard but I like to think I know mostly everything when it comes to easy-to-use devices and setups. I trouble shooted as best I could with customer service. Still no bueno.",149
4,"Great sound. Needs an update regarding Alexa
  
",2.Apr.19,Yes,Alexa app glitchy and somewhat functions.,2
2,"Was awesome for 10 minutes, reset, repeat
  
",8.Apr.19,Yes,"My wife's brother has two Gen 1 of these so I bought one for my wife's birthday. Followed instructions, got it set up. Worked great. Then 10 to 20 minutes later Alexa would say ""I'm having trouble understanding"" Reset it. Re-set it up, same thing. Over and Over. Called Sonos help number and the wait was 45 minutes. No. Returned for the the Amazon speaker which is half the price. Sonos, get your stuff right before releasing.",68
1,"ALEXA VOICE CONTROL DOES NOT WORK OUTSIDE OF USA!
  
",9.Apr.19,Yes,Do not buy if you plan on controlling directly with Alexa Voice Control outside of the USA.,11
5,"great audio quality
  
",10.Apr.19,Yes,Amazing surround sound. Only able to use it with apple tv though. Don't buy it thinking on connecting with tv or any other device in the house only works with Airplay devices. But besides that is a great speaker.,0
5,"It's wonderful.
  
",12.Apr.19,Yes,Sonos is wonderful!! I have filled both my homes with this product and could not be more pleased!,0
5,"Worth the Extra Money over the Sonos 1
  
",16.Apr.19,No,"I went back and forth on the Sone One vs the Play 1.I ended up buying the One.  Because the built in Alexa is not full function and has the annoying beep that you cannot shut off, I silenced the Alexa on this unit.  I use my actual Alexa devices to interact with Alexa.  You may ask why then did I buy this if I do not sue the Alexa that is built in? The answer is simple. The Alexa capability is a software function and I am betting that will improve over time with new releases. This unit has better smarts than the Paly 1 and is more likely and more capable to receive updates; both Alexa and just normal Sonos updates.  If and when the Alexa function catches up, I will turn it back on.I also preferred the aesthetics.  The all black is cleaner than the black/gray.  The touch buttons are superior in look and feel to traditional push buttons.  Overall, it is a more elegant looking speaker.As far as sound goes, it is quite good for my needs.  If you want a large and loud sound these are not for you. For me,I have a few these in difference rooms and I can keep it a low volume and yet hear the music fine in every room.  For gatherings, I don't have to have it blasting in one room and too low in another. I can keep a consistent sound level through all rooms.The Sonos App is great to organize play lists.  I general just control it with Alexa but use the Sonos App to manage long playlist.  If you keep the Rime Music subscription that is also a convenient way to manage playlists and favorites.I also have the Lutron Caseta home system and hence there is some integration that I use with that.  The Lutron Pico Audio remote is a nice thing to have to control the unit from a distance without having to talk to Alexa.",1
3,"Bad connection, great sound.
  
",18.Apr.19,Yes,"If you are getting a Alexa speaker. This is it. The sound is amazing.I have a HomePod at home, and I got this for my GFs place. Sound is real good.But.I got it for Alexa, she_ very into that eco system. She has a normal echo already, and it worked great. The Sonos is alright at best, we first try to connect them both to extend the Alexa reach, it worked. But the Sonos looses connection constantly and needs to be setup again.Since I bought it 2 months ago I have set it up more than 20 times for her. I was hoping it was just a software issue, but it_ still to be fixed.The nights when it just randomly says _ost connection is getting annoying.",25
2,"Alexa integration is a joke.
  
",20.Apr.19,No,Alexa integration is a joke. Good luck with that.Sound quality is mediocre at best if you actually know what good sound is.This is a speaker for background use when trying a hamburger or falling asleep.The Sonos app also needs much improvement.,4
1,"Stay Away - Only plays music through proprietary app!
  
",27.Apr.19,No,These not-so-cheap speakers only play MUSIC through their proprietary app.  You can't connect them to your TV or your computer.  Sent them back on day 1.  Sticking with Bose.,7
5,"Seamless integration with existing speaker Sonos system.
  
",29.Apr.19,Yes,"We bought these to have music in our courtyard and on our patio. Upon powering up and pressing the button, you use your phone/tablet_ sonos app to configure the speakers (room name, mono use or a stereo pair).  It took just a few moments to get them dialed in.  Then, when you decided to play music, you can choose one room or group them together to play the same tunes everywhere. Alexa is handy for controlling the music when you_e outside and don_ want to carry around a phone or tablet.",6
4,"Excellent but could use some tweaks
  
",5.May.19,Yes,Sound quality is excellent for the price.  I think the echo devices that I replaced with the sinus units were more accurate etc. the sonus seems to lose network more easily than a dot even though they are in the same location. But luv the sonus.,3
1,"Device Looses connection randonly,  2.4ghz wifi?
  
",8.May.19,Yes,"I wanted to like this device.  However, the wifi connection is unstable even right beside any of my AP's.  The alexa app often says ""uh ohh""For $200 you'd expect that the device would work,  it doesn't.I never  got around to toying with the other Sonos integrations before sending it back (a week of testing)",16
5,"From frustration to perfection!
  
",16.May.19,Yes,"First off, the sound is great!  I use this speaker in a slightly non-traditional way: we already have the Sonos playbar in front of the TV.  But we sit about 15' back from that. I wanted a speaker in between me and the wife, so we could better hear what's going on.  So, discussed this on a chat-call with Sonos and they recommended this.  All well and good, except I couldn't get it to work.  Luckily, Sonos allows you send a diagnostic of your set-up directly to them via smartphone, detailing what you have etc.  They diagnosed that my router had a setting deep in its controls that prevented the speaker from joining in (there's NO way I wold ever have found this myself).  So, the speaker was working.  But I wanted to to match exactly what was coming out of the playbar.  Sonos explained how to ""group"" the speakers and, subsequently, how to keep them grouped permanently.  The smartphone app makes it easy to adjust the volume level coming out of both speakers, so it creates the sound level most comfortable for you.  Bottom line: it's wonderful!  But kudos to the Sonos support staff.  They were quick to respond and very precise in their fixes.  They turned what was becoming a frustration into perfection.  This is hands-down the best way to listen to your TV!",13
1,"Playlist Annoyance on a Meh smart speaker.
  
",18.May.19,Yes,"Seriously just want to be done with Sonos. Was excited at first but the introduction of the Sonos Playlist is pure cancer. I am listening to a song from the radio. We will take Google service for example. I can add it to my Google library which throws the song into oblivion or I can add it to my Sonos Playlist. Whoopie. I can't use Sonos Playlist anywhere except a place where I have Sonos. So I'm in my car... Nope, on my head phones, nope. At work... Still nope. I want to add songs that I listen to, to whatever Playlist I want. It would be so simple and it used to do this. Click add to Google or whatever Playlist and then choose one.All I now get is Sonos. By doing this you take away my ability to be mobile and convent which I believe is the corner stone to the product. Alexa or Google assistant and extremely slow and most of the time doesn't recognize my voice if the music volume is up.Last piece I know Sonos Playlist is good for home allowing me to utilize multiple different playforms of music. But it should be an option not the only thing.Please fix this and I will update my review.",34
3,"Historically lacking product support over time.
  
",21.May.19,No,"Love the sound. Easy setup. Wi-Fi connectivity is finicky. The worst and I mean the worst thing about this brand, and it's scary, is down the road they just decide to not support the product and it is worthless. It has happened to me on two different items in the past. One day there is an update and all of a sudden it no longer recognizes their own product on the network. Their response, we no longer support that. You now have several hundred dollars in garbage. It is a terrible corporate decision.",3
3,"Alexa support is prehistoric..
  
",21.May.19,No,"Sorely lacking for Alexa functionality. It's really like having Alexa when she was first released years ago. Very basic things like time or weather are fine, but everything else is either unavailable or unreliable. Sending messages to kids rooms or playing music on all speakers... Nope.. wish I had returned when I had a chance.",4
5,"simply a game changer
  
",23.May.19,Yes,no doubt the very best speaker on the market. it is so good the only downside is that you will want the entire system - its hard to listen to music or watch shows any other way now,0
4,"The best multi room speaker
  
",27.May.19,Yes,"Not going to praise sound quality and design, it's all top. What I'll do instead is describe some tech limitations I didn't know about when was buying my Ones.1. AirPlay doesn't work when Ones are connected to the Bar or Beam as surround speakers.2. Google Assistant's Voice Match technology is not supported. So if you're using different Spotify accounts for different family members. Voice Match is amazing functionality to avoid your Spotify music suddenly stopped because someone else requested music with voice at home. Also, you can't ask for personalized routines because the speaker doesn't know who's talking to it. Sonos/Google, please doesn't do this to us!3. One can't be paired with any other speaker but One in a stereo pair.4. I don't know if it's Airplay or Sonos, but initiating playback through Airplay takes a while. Like 5-10 seconds or so. Annoying.Despite found limitations, want to buy more. Great design and sound wins.",6
5,"Alexa, come on!
  
",29.May.19,Yes,"The integration is something we are still struggling with, but the sound is great!",0
3,"a great idea with serious software issues
  
",1.Jun.19,Yes,"Depending on when you ask me, I will either tell you I love these speakers or kind of hate them with a white hot burning passion. I've been looking for a whole-house sound system for a while. I have a very strong mesh WiFi network, so when I saw these speakers and the reviews talking about how great the sound was, I decided to take the plunge and purchased a bunch of them (10) to hang everywhere around my house, basement to second floor.At first, I absolutely loved them. Their sound, as reported by others, is excellent. And the addition of Alexa made controlling them so convenient. I really fell in love with them and started telling everyone about how great they were. Then, about 4 weeks in, I started running into issues which have plagued me ever since, and I can't seem to get the system back into a stable state.The issue seems to stem from the integration with the Amazon Alexa software. The first odd thing I noticed was that occasionally, the speakers seem to just turn dumb, for lack of a better term. You wake them to ask for something and they ding indicating they are listening, but no matter how carefully you articulate your request, they pause for a few seconds and then just die. Or they respond to confirm a request for something that doesn't even remotely sound like what you requested. Or, perhaps most annoyingly, they respond correctly and start playing the thing you requested for about 10 seconds before just fading out and stopping without explanation.I have tried restarting the speakers, my cell phone, my WiFi, and my Internet router, all to no avail. When the speakers just decide to not work for some reason it seems you have no choice but to wait for 6 or 7 hours or so for them to start working again, for reasons as mysterious as the reasons they stopped. I can't tell you how aggravating that is, particularly since these speakers are supposed to be a nice mid-level solution that should just work.Another annoyance I've noticed is that occasionally one of the speakers will simply drop from the Sonos software, causing that speaker to be completely unresponsive and uncontrollable no matter what you do. The only way to re-add it to a group when this happens is to stop all activity on every speaker and have them do their best impressions of expensive bricks until you open the Sonos software and find that the missing speaker has reappeared. Which leads to another bug, which is that sometimes the speakers will simply decide to not take commands, verbal or in the Sonos software. You tell them to 'stop' or 'cancel' and they don't. So you grab your phone and open the Sonos app, click on the speaker group, and click the stop button and...nothing happens. Just keeps right on playing. It's absolutely maddening to be ignored like this by your ""digital assistant""; you are often left with no choice but to go around unplugging speakers around the house to get everything back to a base status.These problems could be YMMV type issues; plenty of reviews practically glow when talking about them. It could also be that by buying so many I exposed myself to more hassle than most and would have been better off purchasing fewer of them and accepting some sound gaps. But my feeling is that as these are not cheap speakers, and that since at least according to the product literature I should be able to setup the speakers in a configuration like this, it shouldn't  be this much hassle.My gut feeling is that the integration between Sonos and Amazon is not very stable and that problems crop up over time. I say this because I have noticed that Alexa updates seem to happen at a breakneck pace, which introduces weirdness all on its own. For example, for over a month I could ask Alexa to 'play NPR' and the speaker would open the radio station without issue. Then one day the exact same request prompted a series of questions about where I lived, which station identifier I wanted, etc. What the heck? Why take something that worked and make it more complex for no reason whatsoever?The bottom line is that when they do work they are amazing. I just wish Sonos and Amazon could get some more stability into their products, because otherwise this will never be more than a niche product.Edit 12/15/2019:I was going to ignore the comment by the manufacturer, but since this is the season when people might be spending a lot of money on these things, I'm just going to post a quick follow-up. In between the quietly sponsored 5 star ""reviews"", manufacturers do damage control PR when someone does post a negative comment about their products. The responses are meant to convey the idea of 'sure, here is a negative comment, but we're nice guys and look how politely we listened to his complaint and offered to help; this negative experience was probably not even our fault and in any case it certainly won't happen to you.'So here's my truth: I did take them up on their suggestion to call for support. It was an agonizing multi-hour call where they had me repeat the exact same troubleshooting steps over and over and over again, right down to connecting the devices to the local LAN for setup and using a computer connected to the LAN to run tests against them. Nothing they did fixed the issues, but the technician had no strategy but to keep asking me to repeat the same steps until, after 6 repetitions or so, I gave up in frustration. And honestly, I think that was his goal. He certainly wasn't learning anything by asking me to repeat the steps ad nauseam when we were receiving the exact same results each time. I think the idea was that if they could make me give up in frustration first, they could frame the experience as me giving up when all they wanted to do was help. It's actually clever, in it's own infernal little way.The reality is that if you read commentary around the web, you'll see that I'm not the only one reporting weird, glitchy behavior out of these devices, particularly if you are using the Alexa interface as opposed to the Google one. The rate of issues also seems to be affected by how many you have on your network. One or two, and you might not have many issues. More, and the odds seem to shift considerably. This product has (in my opinion) a hardware or software (or both) issue that causes the speakers to drop out periodically without explanation, occasionally flat out refuse to join a network, or go dead to commands for random periods of time. I can't say that if you buy these you absolutely will have a problem, but I feel comfortable saying that there is a chance, and it might be higher than you would be comfortable with, given the expense of the units.",14
