Rating,Title,Date,Verified Purchase,Body,Helpful Votes
5,"Excellent, complete home audio system. Alexa/Google Assistant available, but not yet fully capable
  
",1.Jun.19,No,"When I had just purchased a home, I was looking into having it wired for whole-house audio. Looking into multi-room systems on Amazon, it was apparent to me that it wouldn't be cheap: cost of the speakers, controllers, PLUS cost of running wires throughout the house. When I saw the SONOS PLAY:1 promotions, I found its wireless solution to be more cost effective, and with better speakers to boot. I have since tried the SONOS ONE speakers that were realized in late 2017. In 2019, the Sonos ONE (Gen 2) was released, which currently offers no significant advantages over its predecessor except for 2 areas: faster processor (for future expansion) and Bluetooth LE (for speaker setup via Bluetooth at this time).Below are the pros and cons that led me to decide for the Sonos system.NOTE 1: a Sonos BRIDGE is NOT needed to use the PLAY:1 or ONE. See the INSTALLATION section of this review.NOTE 2: the PLAY:1 is the same as the ONE without voice and touch integration. As such, the PLAY:1 is less expensive.NOTE 3: the ONE (Gen 2) is virtually the same as the ONE (Gen 1) except for a faster processor and Bluetooth LE included. This makes it slightly more future proof.PROS- Hi-Fi. Speakers sound better than the multi-room, wired systems I looked at for less than $500.- Resale Value. Wired speakers don't add much resale value to your house. So, why spend $1000s, only to leave the audio system behind when you sell the property or move? With wireless, I could take my expensive speakers with me to my new home.- Freedom to move around.With wireless, you are free to take the speakers anywhere you want throughout the whole house. For neighborhood block parties, I could even hook up the speakers to an extension cord out to the street, and stream music from my home. Or take it outside to your backyard. They are moisture-proof, but I wouldn't use them as permanent outdoor speakers unless you enclose them in protective casings.NOTE on wireless: each SONOS component is its own wireless client and repeater. Sonos wireless is a private, wireless ""mesh"" system, separate from your home WiFi. What does that mean to you? It routes music through its own wireless, leaving your home WiFi untouched. There's an additional benefit for that, as I'll explain after the installation note below. Most of the Sonos components (PLAY:1 and ONE are NOT one of them) have 2 network ports. This means, you can plug in the component into the network jack, and use the 2nd one on the speaker to connect your laptop.- Alexa integration: the speakers now support voice control, though it is a work-in-progress. Sonos updates the capabilities via software updates over time. Google Assistant support is scheduled to come in 2019, making the ONE a more desirable option than having a Google Home and Amazon Echo in the house. I do get frustrated far more often with Alexa not understanding me or my request. My whole family enjoys Google Assistant's better answers and ability to understand us. We can't wait for Sonos to bring the Google Assistant to the ONE. Note: we aren't fans of the Alexa on the Echo Dot either. Google Assistant is just that much better at recognizing commands and providing data. However, Alexa is a bit more advanced in the automation space. Pros and Cons, but that's for another review.[Update 5/2019 Google Assistant integration: it finally arrived and wow, the voice recognition is SO MUCH better! Our whole family is actually happy. Note that Assistant is not yet as fully capable as on Android smartphones or Google Home, but it is sufficient for answering queries and controlling smart devices.]INSTALLATION: First, the tech talk. You need 1 Sonos component to be plugged in to your home network (any of the PLAY speakers, Soundbar, Bridge, etc.) So, as an example, you must plug in either the BRIDGE or the ONE to your network with a network cable. This turns that component into a wireless access point (or as consumers tend to call it, a ""Wifi router"".) All other Sonos components will now be able to wirelessly talk to that plugged-in device. No other Sonos component has to be plugged in, as long as it's within wireless range of the plugged-in one. Should a component in your house be too far away (say, your garage) from the plugged-in one, you can connect it to your network via cable, if available, or set up a Sonos BRIDGE (or any other Sonos speaker) wirelessly somewhere between the plugged-in one and the Garage speaker. The BRIDGE or other speaker strengthens the wireless from the plugged-in one, and extends the range to the one in the Garage. Each Sonos component is both a wireless client, and a wireless access point/repeater. Each component talks to each other in a mesh network. Think of a spider net. Any part that is touched vibrates to the rest of the net.Tech-talk aside, think about this: One person (Person 1) is at a corner of the house. When he shouts, the person in the garage (Person 2) can't hear Person 1. The only way Person 1 can talk to 2, is to pick up the phone (talking over a wired connection, or plugging a distant Sonos component to the wired network) or having Person 3 stand between them (having a Sonos component physically be between both speakers) and relaying the information back and forth (what WiFi mesh would do). So, with each Sonos component/speaker, the Sonos wireless range gets extended.With the Sonos wireless mesh, you could humorously place a few speakers into each house in the neighborhood, and suddenly play the same music through each home. Try that with Bluetooth speakers. You wouldn't be able to.WiFi mesh TIP: if you have an Android device, you can Google ""Android devices on SonosNet"", and you will see instructions on how to use your Sonos wireless network (""SonosNet"") to connect your Android phone/tablet. This allows you to use your mobile device further away from your home WiFi. This has disadvantages and advantages out of the scope of this review. I decided not to use SonosNet for my tablets.NOTE: a Sonos BRIDGE is NOT needed to use the ONE. Just plug in the ONE to the wired network (ie your router), and it will work just fine. You still control it with the Sonos App from your mobile device. Once the ONE is plugged in, you can add other Sonos components to the system. A BRIDGE is NOT needed for that either. It's only needed if you want to extend the Sonos wireless range to a farther part of your house or yard for $50 vs buying another PLAY speaker for $100+)- Small size. The BRIDGE is about the same size as an Apple TV/Roku/WD TV Live. The ONE is about 2-3 of them stacked on top of each other. The ONE has a fairly hefty weight, a good sign of the good sound coming from its components.- Ease of Pairing. To pair other Sonos components (or with the Sonos Controller App), simply hit the Play/Volume Up button on the speaker, and the same combination on the other speakers. If pairing with the BRIDGE, hit the pair button on that component.- LED. The Bright LED can be configured to turn on/off via the Sonos app.- Ease of music sync.You can use the free Sonos app for your Android, iOS (iPhone/iPad/iPod), Windows Phone, Mac/Windows laptop/tablet (sadly, no Windows Store app yet) to control how the speakers play: you can easily choose which speakers to pair/unpair into groups. Grouping the speakers allows you to play the same music on those speakers. You can have up to 32 separate groups. You can also individually control each speaker from the app. Each group's volume is controlled by the Sonos app. So, if Speaker 1 is set to 50% volume, and Speaker 2 is set to 25%, lowering the volume by 5% will lower Speaker 1 to 45%, and 2 to 20%.Once music is playing, you can leave the house, and it will continue to play -- as long as the music source is not coming from that mobile device (meaning: if you're playing MP3s from your phone, and your phone leaves, it will stop playing. But if you started Pandora from your phone, or you told the speaker to play music off one of your network shares, it will continue playing since the source is coming from a device that's still at home.)PARTIES: one cool feature is that once you download the Sonos Controller app and pair it to one of the Sonos speakers (which authorizes the app/phone to talk to your Sonos system -- this prevents unauthorized people outside your home from controlling your speakers), each device can control the playlist. So, if you have guests coming over, and each guest downloads and authorizes the Sonos app to your system, each guest can now add/remove songs from the queue. Everybody can now be a DJ.- Stereo pairing for ONE.You can take two ONE speakers and set them up as Left &amp; Right channels for stereo output. WARNING: you cannot pair ONE and the older PLAY:1 for stereo. You either have to use two PLAY:1 or two ONE.- Expandability.Sonos did a smart thing. They released the less expensive PLAY:1/ONE to wet your/my appetite. As you use the system, you will likely buy more Sonos components to expand your sound system, resulting in more revenue for the company. You can add any Sonos component to your system, and they will all work in harmony. You can set up a complete home theater system that way too. I know, sounds pricey. It is. But it still is cheaper than having your whole house wired with nice speakers.- Alarm/Sleep timer.You can set up each speaker (or Group of speakers) to play music at a specific time, day, and volume (Alarm) from a specific source for a specified amount of time. Or you can also set a Sleep timer to play music for a specific number of minutes to ease you into sleep. I love getting waken up by mellow music (ie. Norah Jones) in the morning, and when I leave the home, I don't have to worry about turning off the speakers. It'll automatically turn off after the 45 minutes I set up for the alarm.- Sound. Sound quality is quite good. I will leave you with the reviews by others to read more about that. With the Sonos app, you can control Bass, Treble, and volume. I have the speakers play between 15% to 25% volume in each room -- they are plenty loud enough. Setting them to 100% can be heard through the whole house -- and the potential for your neighbors to complain. Even at low volume, the sound is very good. It's definitely better than most Bluetooth speakers. If you put the ONE in the corner of a room, the sound seems a bit more muffled due to the amplification of the Bass by the walls on both ends. You can fix this by adding more Treble, or by moving the speaker away from the corner.- Design. The ONE and BRIDGE are beautiful devices. They don't look out-of-place in my home. I bought the White ones.- Capacitive touch control: works very well.CONSI couldn't find many cons with the ONE. But here are some that have annoyed me.- Lack of screw hole for mounting onto stands like the PLAY:1. The ONE replaced the PLAY:1's screw hole with the power button. As such, an entirely new stand needs to be purchased, and Sanus makes one that accommodates the ONE and Play:1.- Cost. The Sonos system is expensive. Just look at the price of the other components. Holy moly. Still, if you were to wire your house with Bose speakers, the Sonos system is comparatively inexpensive. Again, I chose Sonos because wiring the house won't add much resale value. I like the idea of being able to take my Sonos with me to my new home.- Sonos App Interface. The app is clunky and looks outdated. It took me a while to figure out where to go to do what (and I love gadgets/toys. I'm a technology tinkerer!). It's not very user friendly.- Music sources. Not all apps can play to the Sonos speakers. You have to use the Sonos App, add the approved source to it, then you can play from that source. I wish you could re-route any audio from any device to the speakers. Pandora, network shares (NAS), iTunes, TuneIt Radio (built-in), iPod/iPad/iPhone, media files on your own Android/Windows device are all possible sources. At one point (if I remember correctly), my not-so-tech-savvy dad was able to beam his iPad's YouTube sound to the speakers without using the Sonos App. I didn't get a chance to verify how he did it, but I did see the ONE being available as a target on his iPad. Perhaps it was playing via the DLNA protocol. Either way, that was neat.- Input source. I wish that the ONE had a Line-in/Aux port so that you can connect any music source to it for playback, such as your TV or existing home entertainment system. Yes, the Sonos CONNECT takes care of that, but look at the price of that component! Even then, the CONNECT doesn't support SPDIF/Optical input.Weren't it for the Amazon/Target promotions on Black Friday, I would have been EXTREMELY hesitant to buy these expensive speakers. I bought two ONE during the promotion. With that said, overall, I'm quite pleased with the purchase. It came out cheaper than wiring the house, and I get to control my music from any of the mobile devices. That's neat. Lower the prices of your other components, Sonos! I hope for increased competition in the market to drive the prices down -- as of today, I'm not aware of any good, alternate, wireless HiFi solution.If you found this review helpful, please hit the ""Yes/Helpful"" button below to encourage me to write more. Thank you!",620
1,"CREATE AN ACCOUNT BEFORE YOU CAN USE IT AND SITE IS DOWN - GARBAGE
  
",2.Jun.19,No,"have a party in a few hours, can't create an account and can't use it via bluetooth or alexa without an account. TOTAL POS",0
1,"STAY AWAY - WORST SONOS PRODUCT EVER, YOU WONT BE HAPPY
  
",3.Jun.19,Yes,"Worst Sonos product ever. If you use Alexa you_l get skips incomplete sentences and nothing played until you get the _orry I'm having trouble right now, so you unplug it and it works for a day. Even using the sonos of app when it gets like this it doesn't work. Spent an hour with a very nice support person trying to fix it sending diagnostic after diagnostic and resting after resetting, but in the end they are just broken, no amount of button pushing or resetting fixes them.  Have  two beams, an amp, three earlier ones and a three,  each work flawlessly. These are crap. Until they fix the software stay away. Been a son is is fan for many years - if this was my introduction never would have spent another cent with them. I would return but trusted Sonos because of my long good history and threw away the boxes. :-(.  DO NOT WASTE YOUR MONEY.",18
5,"SONOS ONE (GEN 2) continues the dominance of Sonos in streaming audio
  
",5.Jun.19,Yes,"I am a longtime user of Sonos products.  I had a full CONNECT system back in the days when there was a dedicated handheld controller, the only product color was white, and you supplied your own speakers.  I have also owned Play:1 and BEAM speakers.  I recently sold my BEAM soundbar in order to buy the two SONOS ONE (GEN2) speakers that I am reviewing today.I was using the BEAM as my TV sound and for music as well.  The BEAM was fine, especially for TV.  But I just missed the versatility and stereo separation of having two speakers.  The inclusion of Airplay 2 in the SONOS ONE speakers was the answer.  I now have the two SONOS ONE speakers set up as paired stereo and they connect via Airplay 2 to my Apple TV unit.The sound from the Apple TV is great and there appears to be no lag.  The sound syncs perfectly with the video displayed on my TV.  I play music from Apple Music, Spotify, and Pandora flawlessly using the SONOS app.  The Alexa functionality works well, although as one reviewer has mentioned you might want to use the Alexa app to set up your SONOS devices to use the ""Computer"" prompt if you have additional Alexa devices in the area.  I have had no connection or network issues.A few tips for setup:Do not plug all your new SONOS devices into power all at once.  Just plug in one and follow the setup on the SONOS app from there.If you are replacing a previous SONOS setup like I was, you may want to disable the SONOS skill in your Alexa app and then re-enable it once your speakers are fully setup.  Be sure to have your SONOS username/password handy.SONOS uses 2.4ghz networking for the speakers.  I have multiple networks on 2.4ghz and 5ghz frequencies and the SONOS setup process automatically found the 2.4.  Not sure but this might be why some users report connection difficulties despite their other devices working properly.  It shouldn't be a problem for most users.Airplay 2 functionality requires a few steps.  For instance, I went to Airplay in my Apple TV settings and enabled Airplay.  Then I added my Apple TV and the SONOS pair (seen as one device in the Home app) to the Home app.  Next I went to Video and Audio in my Apple TV settings and selected the speakers as my Audio Output.Be patient.  The setup can take a little time.  If you are impatient like me you may end up having to unplug a speaker to restart the setup process.  It's no big deal.Overall, I think SONOS has done it again.  I have tried other cheaper multiroom and streaming audio products.  You just can't beat a product that works this well with such great sound.  People are always impressed with the sound and the ability to play almost any song in seconds.  Being able to use these speakers for great TV sound instead of a dedicated soundbar (or even a BEAM) makes them my best home sound purchase.",4
2,"No multi-room support
  
",6.Jun.19,No,Sonos speakers can NOT be added to Amazon Multi-Room Music groups. I verified this with both Sonos and Amazon technical support.,1
1,"Connection issues destroy an otherwise good system
  
",7.Jun.19,No,"This worked fine for a while, but now when I ask Alexa to play any music or radio stations through the Sonos One, 2nd Edition, the response I get is, ""Hmmm. To do that first enable the skill on your Alexa app, and then discover devices."" Of course, the skill shows up as enabled already, but I go ahead and discover devices anyway, but it makes no difference. To make matters worse, adding this Sonos device to my system now means that NONE of my Alexa devices will play radio stations or music. They all tell me to enable the Sonos One skill, which, of course, is already enabled. Oddly, Alexa via Sonos will still tell me the weather, give me my flash briefing, etc., but it won't play music or radio stations. Go figure. I went to the Sonos' support page and tried the fixes available there, but they didn't work. The speaker does still work as part of my Sonos' system, so it's not a total waste, but I bought it for the Alexa integration, so it's almost a total waste.",2
3,"Great sound, incredibly unstable on WiFi
  
",21.Jun.19,No,"I have a small house (~1800 sq ft) with a decent mesh WiFi system (Google WiFi, 4 pucks). Nothing else falls off the network, and I can stream 4K video on the TV in my bedroom, which is farthest away from the main puck in the living room. Throughput within the house - from an Odroid XU4 that serves as a DLNA server to my Macbook Air is anywhere from 600-800 Mbps (megabits/sec), and my internet connection from Cox gives anywhere from 120-150 Mbps.I bought a Sonos One (2nd generation) 2-pack, so I could place a speaker in my bedroom and a speaker in the living room. On the pro-side, the sound quality is excellent; the speakers are easy to group. The Alexa integration is sufficient for my needs - because the speakers can be grouped, I like it that I can play the same music/radio shows on both speakers.What was remarkably bad is the WiFi stability. These things drop off the WiFi network at the drop off a hat. Within one day, I had to reset both speakers twice. Because I have Google WiFi, my solution was plug each speaker directly into a WiFi puck - this works well; they haven't dropped off yet. But its terrible that one has to use ethernet to get these things to work.I actually wonder if they would do better with a non-mesh WiFi system. In any event, for now, I'm satisfied with they way the work. But at nearly $200 apiece, surely Sonos could have got the WiFi working better.",1
4,"Great product. good sound quality at low/med volumes. Mic not perfect.
  
",22.Jun.19,Yes,"Replaced an old Sonos zone player linked to my hifi.  Alexa sometimes doesnt acknowledge me first time. I use spotify for music and probably not as good as using with amazon music service. but still pretty acceptable.  at full volume , you hear distortion in the bass. its good for a small room but not loud enough or enough base for a party. perfect for everyday use though.",2
1,"What an awful Alexa experience. Great speaker.
  
",24.Jun.19,Yes,"What a shame of you to put out a product like this Sonos, I live overseas in Guam, still a US territory and it_ saying Alexa has not yet been released in my country which is absolutely ridiculous. FIX THIS NOW. Very unhappy customer does not work as advertised. Don_ you dare tell me alexa doesn_ work in this _ountry when I can go down the street and literally buy an amazon echo from Macy_, fix your stuff Sonos, I was expecting more from you. As a first time purchaser of your products, if this isn_ fixed, I likely will never buy Sonos products again in the future. This product will not work with Alexa AT ALL overseas do not buy this product very very poorly designed product. Fix the Alexa, and this would be a five star review. Later.",7
5,"Highly recommend
  
",26.Jun.19,Yes,I love these. So worth the cost. The app is awesome too,0
5,"Happy Sonas.
  
",27.Jun.19,No,"I've had my sonas one for about a year and love it. I want to buy my second one unit and was reading some of the reviews and shocked to not see all 5 star ratings! Maybe they have weak or spotty WiFi systems is my guess? Mine works flawlessly around my whole house and yard. So happy to get Iheart radio and create my own free playlist on Amazon. Very, very happy!",2
2,"Headache
  
",2.Jul.19,Yes,"Set up was finicky, Alexa did not integrate well and was actually annoying as compared to my echo show. I ended up getting Play 1 speakers and those were way easier to set up and Alexa worked much better.",1
1,"Doesn't work with alexa
  
",3.Jul.19,No,Doesn't work with alexa,1
3,"Adding to an existing system
  
",6.Jul.19,Yes,Alexa is slower to respond than on a Amazon device.  Also it is difficult (I haven_ figured it out) to add the Sonos to an existing group of Amazon speakers to play simultaneous (ie - Everywhere Group),0
5,"just OK
  
",8.Jul.19,Yes,Spotty Alexa connection.  Sound quality OK for how I use it.,1
5,"sound quality is superb!
  
",9.Jul.19,Yes,Sound quality is the best I have experienced in a small bluetooth/wifi speaker.  It sounds way better than google home(also have).  Still waiting for google home integration(dissapointment).  Alexa may be good for home control but you can't beat google for answering questions in my opinion.  Using mine in a moderatly sized bathroom.,0
5,"Outstanding speaker and Echo replacement
  
",12.Jul.19,No,"I bought this because I wanted to upgrade the Amazon Echo device in my bedroom. I wanted better sound quality, and the sharp good looks wasn't bad either. I ended up liking it so much that I bought a second for stereo sound, then more of them for other rooms. The reliability increased a lot when I plugged a Sonos Booster directly into my router. When this is done, or when one of the speakers is connected, they form their own small network and don't have to compete with other devices on the main home wifi. This worked really well for me as I have a lot of other connected devices. Big thumbs up for these speakers - I love them!",3
3,"Taking away iPhone app function
  
",12.Jul.19,No,Sound quality is great quality of products is great I use it all the time using my iPhone which they are discontinuing so speakers are going to be almost useless I would have not bought them without this feature.,2
1,"Does not work with Alexa Multi Room Music (MRM), not mentioned on product page
  
",13.Jul.19,No,"Sonos One cannot be added to an MRM group with other Echo devices. Not making this clear on the product page is deceiving. Unfotunately, I after intially trying and failing to include it, I waited to try grouping it again, and now I'm stuck with it. Basically useless to me, will be giving it to a friend.",3
1,"Don't expect any suppport from Sonos
  
",15.Jul.19,Yes,"Bought 4 of these for my 72 year old mother. Figured they'd be the easiest for her to use once they were installed.Install was way more of an ordeal than it needed to be but a couple days later, they stop connecting to Amazon, so I go back and set them up again.Three weeks go by, she's used them maybe a dozen times. They stop connecting again. So I go back. More troubleshooting. The app won't connect... reboot the router...still nothing... call support. Support's closed. Wait for Support to open... 27 minutes on hold.... Support transfers to customer service... another 10 minutes on hold... Customer Service can't help because we bought them on Amazon ... Transferred again... Again no help. $180 a piece and this company just plain sucks.",7
